,author,subreddit,subreddit_id,title,author_created_utc,created_utc
3308,rick2882,oil,t5_2qhl1,OPEC shatters oil production records [auto video warning],1339468892.0,1470845104
3309,mronindia,oil,t5_2qhl1,Maize Oil Market in India,1465801852.0,1470896542
3310,oilandgaspostings,oil,t5_2qhl1,An Evaluation of Oil and Gas Properties Guide,1469099175.0,1470902053
3311,MrGrogo,oil,t5_2qhl1,"Oil prices dip on U.S. crude inventory build, record Saudi output",1469810607.0,1470902359
3312,pluslifestyles,oil,t5_2qhl1,Top 9 Health Benefits Of Olive Oil,1401712854.0,1470905420
3313,Obnoxious_Slob,oil,t5_2qhl1,IEA Sees Oil Glut Easing,1467000776.0,1470960859
3314,mathanjitu,oil,t5_2qhl1,Curde Oil tips August month Performance,1373536302.0,1470978960
3315,adrian22222,oil,t5_2qhl1,Blood Type Diet – The Facts And How Ostro Oils Benefit,1415548197.0,1470993308
3316,mronsaudiarabia,oil,t5_2qhl1,Saudi Arabia Takes Major Steps to Pull Revenues from Non-Oil Sectors,1462852885.0,1470995494
3317,varun2410,oil,t5_2qhl1,Can Online Oil &amp; Gas Courses fill the skill gap faced by industry?,1438509831.0,1471092380
3318,ParkerHallam12,oil,t5_2qhl1,Oil Production Facilities Parker Hallam,1460923996.0,1471127208
3319,gaop,oil,t5_2qhl1,"Oil Gets Bounce, Stays Above $40 Threshold For 2nd Week",1212913848.0,1471183609
3320,TexasNorth,oil,t5_2qhl1,"If Oil Prices Don't Rise, the Middle East Will Sink",1392476684.0,1471213864
3321,AbySaxen,oil,t5_2qhl1,"For those who missed the good news- Recording, Presentation and Other important information regarding the first Webinar ""The Next 5 years in Oil&amp;Gas Sector of India""",1469943928.0,1471327598
3322,gtmteleshopping12,oil,t5_2qhl1,Tummy Fit oil,1471330334.0,1471330826
3323,MummyDeals,oil,t5_2qhl1,7 Essential Oils Every Home Needs,1468997219.0,1471349682
3324,Petmax-Flame,oil,t5_2qhl1,Oil Prices Surged 10% In Just 3 Days,1469038326.0,1471355959
3325,PetroleumEconomist,oil,t5_2qhl1,Free: US rail shipments of crude almost half as oil-price spread narrows,1463150057.0,1471364733
3326,uhcougar2013,oil,t5_2qhl1,Advancing the Oilfield Sales Model - Multi-Product Line Selling,1457357651.0,1471378493
3327,hollidaychh,oil,t5_2qhl1,Highest paying oil and gas jobs in TX,1388385416.0,1471388417
3328,kayuzee,oil,t5_2qhl1,Outlook for Canadian oil ... catch an upswing with the service providers?,1418181894.0,1471405365
3329,mohammadkhalid,oil,t5_2qhl1,A brief introduction into Oil Recovery Processes and Recovery Factors,1465884851.0,1471414842
3330,hemaniherbal,oil,t5_2qhl1,Amazing Hemani Herbal Blackseed Oils,1433496709.0,1471420593
3331,mohammadkhalid,oil,t5_2qhl1,Important Information For Aspirants Looking For Oil and Gas Drilling Positions,1465884851.0,1471494922
3332,mohammadkhalid,oil,t5_2qhl1,What Are the Several Benefits of Making a Career in Oil and Gas Industry?,1465884851.0,1471497509
3333,mohammadkhalid,oil,t5_2qhl1,Charterparty Management for Liquefied Petroleum Gas (LPG) Tankers,1465884851.0,1471499029
3334,dexcel,oil,t5_2qhl1,"If peak oil arrives, investors will need to get smarter - FT.com",1273344296.0,1471510168
3335,Tuwaijri,oil,t5_2qhl1,How Peak Oil Was Misunderstood,1471529740.0,1471529827
3336,Martin81,oil,t5_2qhl1,Welcome to the Age of Crappy Oil,1350160438.0,1471601355
3337,gerladconor,oil,t5_2qhl1,Forging a Better Future With Alternative Fuels,1376403846.0,1471610007
3338,Raghavcm,oil,t5_2qhl1,India and China Vie for Greater Share in Oil Sales in Myanmar,1456651616.0,1471677744
3339,GeoStarRunner,oil,t5_2qhl1,TIL in 1999 a French Holocaust survivor reduced Shell Oil's accident rate 84 percent by making oil rig workers talk about their feelings,1419441235.0,1471678388
3340,mohammadkhalid,oil,t5_2qhl1,Oil Gas Budgeting Forecasting,1465884851.0,1471841607
3341,whodat98,oil,t5_2qhl1,"I just want to get something straight. The oil industry has been historically a very up and down industry. However, I've seen slot of people saying that this is the end of the oil industry, prices will never go back up, etc. What makes this time different from the crash in the '80's for example?",1429051032.0,1471842225
3342,PetroleumEconomist,oil,t5_2qhl1,Will paying the public to like fracking make UK shale gas more appealing?,1463150057.0,1471865567
3343,sciencecow,oil,t5_2qhl1,Saudi Permian: A Race To The Bottom For Tight Oil,1419723709.0,1471870589
3344,PetroleumEconomist,oil,t5_2qhl1,"After a hiatus in shale-related activity, Ineos champions UK gas",1463150057.0,1471883568
3345,letsdrillbabydrill,oil,t5_2qhl1,O&amp;G/petrochemical/energy Podcast Recommendations?,1459373277.0,1471921052
3346,mohammadkhalid,oil,t5_2qhl1,How to Look For Oil and Gas Jobs After a Degree In Oil and Gas Engineering?,1465884851.0,1471929113
3347,Eid7,oil,t5_2qhl1,COLUMN-Saudi Arabia isn't flooding oil market ahead of freeze talks: Kemp,1412310687.0,1471962980
3348,Swordsteel,oil,t5_2qhl1,ELI5: Oil Storage,1353112038.0,1471969390
3349,Alisonmelia,oil,t5_2qhl1,Important things you must know about essential oils,1415796784.0,1472033597
3350,vfilipovaMH,oil,t5_2qhl1,Russian oil and gas giant Urals Energy acquired deposit in Barents Sea,1460627284.0,1472033869
3351,ThatTexasGuy,oil,t5_2qhl1,Oil Price 'Roller Coaster' Spurs a Rush for Young Investors- Bloomberg,1339877315.0,1472056695
3352,Valeriy146,oil,t5_2qhl1,"Oil Sags on China Fuel Exports, U.S. Rig Count",1419253578.0,1472088796
3353,Moraomar827,oil,t5_2qhl1,oil markets : thewrap : Donald Trump Cancels Oregon Trip,1422535127.0,1472124504
3354,eleitl,oil,t5_2qhl1,Museletter #291: Is the Oil Industry Dying? - Richard Heinberg,1157554356.0,1472144682
3355,636rigger,oil,t5_2qhl1,Oil - A Public Service Announcement,1449614358.0,1472184050
3356,mohammadkhalid,oil,t5_2qhl1,Management of Charterparty for Oil Tankers,1465884851.0,1472193531
3357,aloksharma123,oil,t5_2qhl1,Africa and Latin America region is expected to experience high growth in oilfield equipment rental market,1467969673.0,1472198126
3358,oblication,oil,t5_2qhl1,Iran says will cooperate with OPEC to stabilize the oil market,1345083292.0,1472200107
3359,aditya-engineers,oil,t5_2qhl1,Best Virgin Coconut Oil Manufacturers,1471859117.0,1472206741
3360,xarc13,oil,t5_2qhl1,Oil Barons Find Narnia in West Texas,1164331111.0,1472246230
3361,nigelf30,oil,t5_2qhl1,"The US oil industry was born on this day in 1859 in Titusville, Pennsylvania when Edwin Drake struck oil with the world's first commercial well.",1447094636.0,1472279582
3362,GeoStarRunner,oil,t5_2qhl1,Oil spikes on report Yemeni missiles hit Saudi Arabia's oil facilities,1419441235.0,1472279777
3363,Faranj,oil,t5_2qhl1,"US oil settles at $47.64 a barrel, up 31 cents, or 0.65 pct",1431154809.0,1472295286
3364,GeoStarRunner,oil,t5_2qhl1,China’s Oil Industry Destined for Big Changes,1419441235.0,1472319792
3365,nirvanna94,oil,t5_2qhl1,Planet Money Podcast - 5 episode series on oil from the well to refined product,1352866197.0,1472332799
3366,AbySaxen,oil,t5_2qhl1,Oges.info - Oil &amp; Gas Knowledge Portal,1469943928.0,1472362485
3367,iranthisway,oil,t5_2qhl1,"Switzerland’s Vitol to buy Iran, Russia swap oil",1460364977.0,1472368710
3369,iranthisway,oil,t5_2qhl1,IRAN’s Oil products export capacity hits 500K bpd,1460364977.0,1472375011
3370,lekemat,oil,t5_2qhl1,For Oil Companies $110 Billion Debt Wall Looms Over Next 5 Years,1387178240.0,1472397974
3371,antimason40,oil,t5_2qhl1,"Venezuela, Iran hold talks on oil price stability",1462206503.0,1472408333
3372,SilverLion,oil,t5_2qhl1,/r/oil Fantasy - August Leaderboard Update,1329970636.0,1472429086
3373,iranthisway,oil,t5_2qhl1,"Iran, Russia ink $1b oil rig deal",1460364977.0,1472461941
3374,aditya-engineers,oil,t5_2qhl1,Best virgin coconut oil manufacturers in India,1471859117.0,1472468324
3375,antimason40,oil,t5_2qhl1,Oil prices sink in Asia on output fears and strong dollar,1462206503.0,1472497103
3376,antimason40,oil,t5_2qhl1,UAE to buy Iranian gas,1462206503.0,1472537218
3377,mohammadkhalid,oil,t5_2qhl1,Things That You Must Keep In Mind When Finding a Job in Oil and Gas Drilling,1465884851.0,1472537237
3378,dunkin1980,oil,t5_2qhl1,Big Oil's Yuge Problem,1455946225.0,1472539579
3379,eleitl,oil,t5_2qhl1,Oil Discoveries at 70-Year Low Signal Supply Shortfall Ahead,1157554356.0,1472551502
3380,PetroleumEconomist,oil,t5_2qhl1,Saudi Arabia’s oil minister says Opec will take “any possible action” to stabilise the market. Will the group agree to cut production at its next meeting in Algiers?,1463150057.0,1472554735
3381,PetroleumEconomist,oil,t5_2qhl1,As China’s oil demand growth slows its gasoline exports are surging,1463150057.0,1472632267
3382,sahar_fard,oil,t5_2qhl1,Iraq mulls selling oil through Iran: Report,1453384217.0,1472635856
3383,IanT86,oil,t5_2qhl1,Uganda push Tullow/Total for 2020 oil production,1361374896.0,1472637433
3384,mohammadkhalid,oil,t5_2qhl1,LNG Bunkering,1465884851.0,1472638534
3385,german-Analist,oil,t5_2qhl1,"Middle East Oil Challenges Russian East-European Oil Cartel, But it is Not a Game Changer",1443679673.0,1472641612
3386,sahar_fard,oil,t5_2qhl1,"Iran to Produce Oil in South Pars by March 2017: Official TEHRAN (Tasnim) – The CEO of the National Iranian Oil Company (NIOC) announced that the country will begin oil production in an oil field of the massive offshore South Pars by the end of the current Iranian year (March 20, 2017).",1453384217.0,1472649309
3388,engineoil25,oil,t5_2qhl1,5w30 oil toronto,1472665539.0,1472665652
3389,engineoil25,oil,t5_2qhl1,Where can you find 5w20 oil in toronto?,1472665539.0,1472666567
3390,engineoil25,oil,t5_2qhl1,What is 5w40 oil?,1472665539.0,1472669330
3391,engineoil25,oil,t5_2qhl1,where can you find motor oil in toronto?,1472665539.0,1472670091
3392,justthatguy9,oil,t5_2qhl1,"(Open Earth Community) Site to Foster Innovation in Oil, Gas Technology Development",1414677027.0,1472693467
3393,Salimar1234,oil,t5_2qhl1,"Coconut oil supplier,coconut edible oil exporter,coconut edible oil manufacturer",1471503568.0,1472717872
3394,annieblitz,oil,t5_2qhl1,The #oil price war: Khald Al-Falih declares oil price peace,1467628108.0,1472718450
3395,GineersNow_Official,oil,t5_2qhl1,10 Largest Oil Companies in the World,1461758072.0,1472728543
3396,Oilinfoorg,oil,t5_2qhl1,Oil Info - Oil Investor Information and Resources,1471521472.0,1472730892
3398,maureenstgermain,oil,t5_2qhl1,Aromatherapy Oil Blends,1470118812.0,1472796771
3399,mohammadkhalid,oil,t5_2qhl1,Communication Skills For Oil &amp; Gas Professionals,1465884851.0,1472798097
3400,dunkin1980,oil,t5_2qhl1,"Infuriating News For Saudi Arabia, Russia Refuses To Play Oil Game",1455946225.0,1472812832
3401,Aromacelesta,oil,t5_2qhl1,LILY Absolute essential OIl,1469779261.0,1472816498
3402,Technicalwhitepaper,oil,t5_2qhl1,Automate Lease Management in The Oil &amp; Gas Upstream Market : White Paper,1471928199.0,1472818213
3403,tareqsalahuddin,oil,t5_2qhl1,Oil prices edged up in Asia after steep falls - it's fluctuating too much,1472491605.0,1472831040
3404,Bizkitgto,oil,t5_2qhl1,Art Berman: Labor Day Weekend Oil Special | Macro Voices,1420276176.0,1472831577
3405,TexasNorth,oil,t5_2qhl1,"Putin calls for OPEC to institute an oil production freeze, but with an exemption for Iran",1392476684.0,1472877087
3406,mg12news,oil,t5_2qhl1,Benefits of Magnesium Oil | MG12.com,1472894080.0,1472898517
3407,dunkin1980,oil,t5_2qhl1,Worst Oil Crash In A Generation: When Will It End?,1455946225.0,1472905267
3408,Oilinfoorg,oil,t5_2qhl1,Oil Info - Oil Investor Information and Resources,1471521472.0,1472907525
3409,eleitl,oil,t5_2qhl1,"Art Berman: Oil Is Heading Lower Near-Term Before ""Economically-Crippling Moon-Shot""",1157554356.0,1473069512
3410,Oilinfoorg,oil,t5_2qhl1,Oil Industry Overview,1471521472.0,1473086554
3411,Oil_Baron_,oil,t5_2qhl1,"Russia, Saudi Arabia agree on joint action to stabilise oil price",1471652479.0,1473103840
3412,mohammadkhalid,oil,t5_2qhl1,Making a Career in Oil and Gas Industry,1465884851.0,1473144703
3413,Oilinfoorg,oil,t5_2qhl1,Oil Investor Concerns,1471521472.0,1473160847
3414,Bizkitgto,oil,t5_2qhl1,Enbridge to Buy Spectra Energy in $28 Billion All-Stock Deal,1420276176.0,1473171309
3415,mytradingbuddy,oil,t5_2qhl1,APA Zones Futures Crude Oil and S&amp;amp;P Forecast 9/7,1413051948.0,1473229145
3416,saamsrick,oil,t5_2qhl1,Rick Simpson Oil in Australia,1469618117.0,1473240409
3417,ayelliarganoil,oil,t5_2qhl1,100% Pure Moroccan Argan Oil,1458114020.0,1473243073
3418,Oilinfoorg,oil,t5_2qhl1,Texas Oil &amp; Gas Investor | Oil and Gas Investment Opportunities - Oilinfo,1471521472.0,1473253833
3419,TexasNorth,oil,t5_2qhl1,People are almost completely ignoring a looming crisis for oil,1392476684.0,1473255483
3420,eleitl,oil,t5_2qhl1,People are almost completely ignoring a looming crisis for oil,1157554356.0,1473261580
3421,Brainroots,oil,t5_2qhl1,Apache Has High Hopes for New Oil-Field Discovery in Texas,1468687329.0,1473272581
3422,Valeriy146,oil,t5_2qhl1,Oil Slips Below $47 as Hopes for Producer Action Wane,1419253578.0,1473293675
3423,ananamass,oil,t5_2qhl1,$40 Million Iranian Oil Platform sinks to bottom of Persian Gulf,1357410471.0,1473300934
3424,mohammadkhalid,oil,t5_2qhl1,What Are the Several Benefits of Signing up with an Energy Professional Network?,1465884851.0,1473313157
3425,eleitl,oil,t5_2qhl1,Peak oil by any other name is still peak oil,1157554356.0,1473342815
3426,vinh2231984,oil,t5_2qhl1,Castrol Scooter Gear oil 80W-90 (dạng Típ),1472235160.0,1473347315
3427,Oilinfoorg,oil,t5_2qhl1,Oil and Gas Exploration | Oil Exploration Companies | Oil Investor Information &amp; Resources - OilInfo,1471521472.0,1473347353
3428,Lubricant_Oil,oil,t5_2qhl1,Cutting Oil Suppliers in Rajasthan,1473413258.0,1473413349
3429,aloksharma123,oil,t5_2qhl1,The oilfield equipment rental market is estimated to grow with a projected CAGR of 14.9%,1467969673.0,1473421440
3430,Oilinfoorg,oil,t5_2qhl1,Oil and Gas Industry Texas | Us Oil Industry | Oil &amp; Gas Industry Overview - OilInfo,1471521472.0,1473425920
3431,eleitl,oil,t5_2qhl1,Crude Oil Freight Rates Plunge to Record Lows,1157554356.0,1473427203
3432,gdswareusatexas,oil,t5_2qhl1,We Provide Fast and Convenient Oil and Gas Software,1472844983.0,1473475003
3433,Oilinfoorg,oil,t5_2qhl1,Oil Investor | Oil &amp; Gas Investor | Texas Oil &amp; Gas Investor Concerns - OilInfo,1471521472.0,1473487574
3434,Ebele-Kemery,oil,t5_2qhl1,Crude Oil - The Different Benchmarks for Traders and Investors,1473057416.0,1473487928
3435,kverma0333,oil,t5_2qhl1,Organic sesame oil benefits,1441704111.0,1473489093
3436,saamsrick,oil,t5_2qhl1,Cannabidiol Oil in Australia,1469618117.0,1473491079
3437,aditya-engineers,oil,t5_2qhl1,Vegetable Oil Refinery Plant in India,1471859117.0,1473499212
3438,svilenp,oil,t5_2qhl1,China increased imports of crude oil and coal to record levels,1465817326.0,1473500573
3439,Oilinfoorg,oil,t5_2qhl1,Oil &amp; Gas Investment | Oil Well Drilling | Oil Investment Risks - OilInfo,1471521472.0,1473680771
3440,protankenvi,oil,t5_2qhl1,oil tank replacement doylestown,1432038672.0,1473703707
3441,mohammadkhalid,oil,t5_2qhl1,Job Role and Responsibilities Of an Oil and Gas Engineer,1465884851.0,1473757546
3442,mytradingbuddy,oil,t5_2qhl1,APA Zones Futures Crude Oil and S&amp;P500 Forecast 9/13,1413051948.0,1473786584
3443,AbySaxen,oil,t5_2qhl1,"#Requirement of Operations Incharge - Crude Oil Terminal / Pipeline. Professionals, if you are experienced in this field then it’s a great opportunity for you. Apply for the job below with necessary details here at http://www.oges.info/142921/operations-incharge-crude-oil-terminal-pipeline",1469943928.0,1473828447
3444,svilenp,oil,t5_2qhl1,Pemex made six light crude-oil discoveries in the Gulf of Mexico with deposits of 200m BoE,1465817326.0,1473836911
3445,pluslifestyles,oil,t5_2qhl1,Top 6 Methods to use Rosemary Oil for Hair,1401712854.0,1473839212
3446,pluslifestyles,oil,t5_2qhl1,Benefits of Castor Oil for Hair,1401712854.0,1473844825
3447,-Log-Fallacy,oil,t5_2qhl1,Visual Representation of Global Oil Trade - (#1 Exported Product in the World),1441405174.0,1473849748
3448,oilandgaspostings,oil,t5_2qhl1,Best Opportunities in Oil and Gas Investment Business,1469099175.0,1473854591
3449,dexcel,oil,t5_2qhl1,Iran's Plan to Lure Big Oil - Bloomberg,1273344296.0,1473869520
3450,annieblitz,oil,t5_2qhl1,#Goldman Sachs' Head of Commodities: there are no stimuli for oil price to soar,1467628108.0,1473928048
3451,iranthisway,oil,t5_2qhl1,ran draws up new plan for gas exports to Europe,1460364977.0,1473934281
3452,aditya-engineers,oil,t5_2qhl1,Oil mill plant manufacturer India,1471859117.0,1473934558
3453,eleitl,oil,t5_2qhl1,"T. Boone Pickens Was Right About Peak Oil, Joe Kernen Was Wrong",1157554356.0,1473937197
3454,mohammadkhalid,oil,t5_2qhl1,LearnersEDGE : Reinventing Oil &amp; Gas training with Virtual Reality (VR) Technology,1465884851.0,1473939637
3455,TexasNorth,oil,t5_2qhl1,"Oil downturn nearly over, Norway says. Oslo nevertheless doesn’t expect oil to hit $60 per barrel again until 2019.",1392476684.0,1473991002
3456,TexasNorth,oil,t5_2qhl1,Oil industry predictions thread,1392476684.0,1473994889
3457,craigie1211,oil,t5_2qhl1,Oil Company Merlin ERD Receives Royal Recognition.,1426088184.0,1474015753
3458,TexasNorth,oil,t5_2qhl1,When oil turns it will be with such lightning speed that it could upend the market again,1392476684.0,1474072267
3459,Taco_Truck_Affici,oil,t5_2qhl1,Oil Glut Set to Worsen as Nigeria and Libya Fields Restart,1472847872.0,1474252008
3460,adrian6767,oil,t5_2qhl1,Why does the us consume so much oil?,1462132283.0,1474271002
3461,Raileymak,oil,t5_2qhl1,Lubricant Oil Testing Australia,1470633062.0,1474277014
3462,FerozWills,oil,t5_2qhl1,Best Indian Sandalwood Santalum Album Essential Oil,1474278155.0,1474278219
3463,mronsaudiarabia,oil,t5_2qhl1,Saudi Arabia Oil Gas Industry Analysis and Forecast Report,1462852885.0,1474283316
3464,Oilinfoorg,oil,t5_2qhl1,Investing In Oil and Gas Texas | Evaluating Oil &amp; Gas Investments Texas - OilInfo,1471521472.0,1474287897
3465,mohammadkhalid,oil,t5_2qhl1,Top 5 considerations during low oil prices,1465884851.0,1474288861
3466,german-Analist,oil,t5_2qhl1,US shale oil collapsing: Permian Basin as the last bastion,1443679673.0,1474359877
3467,oilandgaspostings,oil,t5_2qhl1,Why Oil and Gas Development Projects is Best for Money Invest,1469099175.0,1474367628
3468,Bizkitgto,oil,t5_2qhl1,Shell cuts jobs in Norway | Offshore Energy Today,1420276176.0,1474376331
3469,Oilinfoorg,oil,t5_2qhl1,Oil and Gas Investment Guide | Oil Investment Guide | Free Oil Investment Guide - OilInfo,1471521472.0,1474379632
3470,eleitl,oil,t5_2qhl1,What really causes falling productivity growth — an energy-based explanation,1157554356.0,1474436556
3471,aloksharma123,oil,t5_2qhl1,Transformer Oil Market is expected to be a fast growing market from 2015 to 2020,1467969673.0,1474449555
3472,Oilinfoorg,oil,t5_2qhl1,Oil and Investment Resources | Oil Investment Advice - OilInfo,1471521472.0,1474453621
3473,Darrkett,oil,t5_2qhl1,Evolution Of The Oil Industry - Bureau of Mines Documentary,1430882552.0,1474476928
3474,adriandgarcia,oil,t5_2qhl1,What the hell is going on with Colorado’s oil and gas industry?,1466117359.0,1474488132
3475,blessedseedoil,oil,t5_2qhl1,Black Cumin Seed Oil,1473766858.0,1474522580
3476,PetroleumEconomist,oil,t5_2qhl1,"FREE: Iranian oil-output is surging, for now. But without IOCs, longer-term increases will prove much more difficult",1463150057.0,1474540661
3477,Oilinfoorg,oil,t5_2qhl1,US Oil &amp; Gas Industry | Texas Oil &amp; Gas Investing Blog - OilInfo,1471521472.0,1474541888
3478,Sweetnam,oil,t5_2qhl1,Pipeline shutdown disrupts gasoline supply in the Southeast,1445962561.0,1474558266
3479,mishukutubi,oil,t5_2qhl1,Bangladesh Oil Gas and Mineral Corporation Petrobangla Job Circular 2016,1278179103.0,1474562795
3480,misesfan463728,oil,t5_2qhl1,"Dumb question: Is it possible to see an oil gusher in real life these days? Has anyone created tourist attractions for that? In Texas someplace, or somewhere else?",1444492241.0,1474575968
3481,uhcougar2013,oil,t5_2qhl1,For my unemployed oilfield brothers and sisters,1457357651.0,1474581554
3482,Veetildigital2,oil,t5_2qhl1,3D Animated OIL &amp; GAS - PERSPECTIVES,1464415006.0,1474613883
3483,kemioyl,oil,t5_2qhl1,"The Magic of Vedas, Now in Oil",1463032264.0,1474623930
3484,mohammadkhalid,oil,t5_2qhl1,Who Should You Join the Oil and Gas Industry?,1465884851.0,1474625862
3485,asdfghhrhfhfy,oil,t5_2qhl1,waste oil heater for garages,1469704543.0,1474627009
3486,Oilinfoorg,oil,t5_2qhl1,Oil &amp; Gas Formations In Texas | Oil &amp; Gas Formation Details - OilInfo,1471521472.0,1474706479
3487,youngmeezy,oil,t5_2qhl1,1973 Oil Crisis Effects?,1349918609.0,1474824921
3488,lakshmanarajN,oil,t5_2qhl1,how to clean up oil spills,1474821750.0,1474831918
3489,dunkin1980,oil,t5_2qhl1,A legendary investor thinks electric cars will raise the price of oil,1455946225.0,1474866499
3490,Energy_Karel,oil,t5_2qhl1,Chinese national oil companies: giants built on shaky foundations,1425397055.0,1474883347
3491,TaynaVenice,oil,t5_2qhl1,Argan Oil 100 Percent Pure,1474887991.0,1474888105
3492,Jonnybagofdonuts,oil,t5_2qhl1,Oil's rallying as OPEC talks begin,1447365041.0,1474897391
3493,Oilinfoorg,oil,t5_2qhl1,Investing In Texas Oil Wells &amp; Drilling | Investing In Texas Oil Drilling Companies - OilInfo,1471521472.0,1474902130
3494,PetroleumEconomist,oil,t5_2qhl1,A deal to reopen Libya's oil ports should be good news for investors. But convincing them to return may take time,1463150057.0,1474903889
3495,SOSCalifornia,oil,t5_2qhl1,Natural Oil Seeps | Why are we wasting this precious resource?,1445298247.0,1474910184
3496,uszlachetniacze,oil,t5_2qhl1,Valvoline MaxLife 10W40 How clean is engine oil? Test 100°C,1458650283.0,1474914054
3497,pertuatech,oil,t5_2qhl1,What is Engine Oil Treatment and How it Works? | Pertua,1459824364.0,1474957650
3498,annieblitz,oil,t5_2qhl1,Oil output deal expectations are down: oil prices drop,1467628108.0,1474966002
3499,mohammadkhalid,oil,t5_2qhl1,Why to Enroll in an Oil and Gas Course?,1465884851.0,1474970067
3500,PetroleumEconomist,oil,t5_2qhl1,Oil producers are meeting in Algiers to discuss a freeze. Even if a deal is reached their export revenue will plunge,1463150057.0,1474971878
3501,Oilinfoorg,oil,t5_2qhl1,Investing in North Texas Oil and Gas | Oil &amp; Gas Investing Texas - OilInfo,1471521472.0,1474975022
3502,eleitl,oil,t5_2qhl1,Texas Oil and Natural Gas Update- Sept 2016,1157554356.0,1474976367
3503,Jonnybagofdonuts,oil,t5_2qhl1,Iraq says it supports an oil production freeze,1447365041.0,1474989073
3504,shaikhfarah,oil,t5_2qhl1,Oil Reserves Boosts Trading Companies performance in UAE,1468409471.0,1475044057
3505,shaikhfarah,oil,t5_2qhl1,Oil companies in Dubai recycle oil for environmental benefits,1468409471.0,1475044904
3506,economicswire,oil,t5_2qhl1,Karoon Gas Australia acquired full equity interest in five Santos Basin blocks,1460101895.0,1475046993
3507,gafuller,oil,t5_2qhl1,Interesting graph shows the bankruptcy risk trend in the US oil &amp; gas industry,1372665448.0,1475059402
3508,putsomecolourson,oil,t5_2qhl1,OPEC agrees to limit oil output at 32.5 million barrels per day,1390926031.0,1475089920
3509,jaswinderkaurease,oil,t5_2qhl1,Benefits of Clove Oil and Mustard Oil,1460915695.0,1475094786
3510,PetroleumEconomist,oil,t5_2qhl1,Opec has finally reached a deal to cap oil output at 32.5m-33m b/d. We explain how it could work http://tinyurl.com/zl9yxwq,1463150057.0,1475095422
3511,xarc13,oil,t5_2qhl1,How Actual Nuts and Bolts Are Bringing Down Oil Prices,1164331111.0,1475096127
3512,Timlskamp,oil,t5_2qhl1,Oil prices rise after OPEC announces first output cut since 2008,1443263664.0,1475126928
3513,oilandgaspostings,oil,t5_2qhl1,How to Calculate Oil and Gas Overrides,1469099175.0,1475152331
3514,Heywoiaknk,oil,t5_2qhl1,Oil extends advance in post OPEC deal positioning,1443007107.0,1475215682
3515,Jimiendr,oil,t5_2qhl1,Oil prices surge after OPEC agrees surprise cut in production,1443004756.0,1475216631
3516,blessedseedoil,oil,t5_2qhl1,Black Seed Oil For Cancer UK,1473766858.0,1475220694
3517,blessedseedoil,oil,t5_2qhl1,Black Seed Oil: A Means of Remedy From Diseases,1473766858.0,1475229345
3518,blessedseedoil,oil,t5_2qhl1,Ways To Get Complete Benefits Of Black Seed Oil,1473766858.0,1475236222
3519,dexcel,oil,t5_2qhl1,China may be stockpiling more oil than anyone realized - WP,1273344296.0,1475237247
3520,MARTINADENNY,oil,t5_2qhl1,Oil Storage Market - Global Industry Analysis; Latest Research Report 2016,1475236065.0,1475237257
3521,heinsider,oil,t5_2qhl1,BPs Oil Spill Plans Labelled 'Flimsy' by Australian Wilderness Society,1439944990.0,1475249099
3522,danielviktor,oil,t5_2qhl1,Oil Rig Jobs and How to Get One,1471975237.0,1475256566
3523,Oilinfoorg,oil,t5_2qhl1,Investing In Oklahoma's Oil &amp; Gas | Oil &amp; Gas Productions Oklahoma's – OilInfo,1471521472.0,1475327385
3524,iranthisway,oil,t5_2qhl1,Iran gas pipeline to Iraq+photo,1460364977.0,1475344344
3525,Oil_Baron_,oil,t5_2qhl1,BP Statistical Review - Behind the Price of Oil,1471652479.0,1475349858
3526,itsrattlesnake,oil,t5_2qhl1,Best description I've ever seen regarding working on oil rigs.,1294862738.0,1475349981
3527,sciencecow,oil,t5_2qhl1,"Video–No Place to Go For Tight Oil: Houston Geological Society September 26, 2016",1419723709.0,1475351116
3528,iranthisway,oil,t5_2qhl1,Iran and Japan cooperate in fuel oil,1460364977.0,1475436467
3529,mronindia,oil,t5_2qhl1,Compressor Oil Market in India,1465801852.0,1475476460
3530,mohammadkhalid,oil,t5_2qhl1,The International Oil &amp; Gas Executive Development Program,1465884851.0,1475488493
3531,iranthisway,oil,t5_2qhl1,Iran able to achieve target of 4m bpd oil output,1460364977.0,1475511872
3532,shaikhfarah,oil,t5_2qhl1,Oil and Gas Companies drive economy in Dubai,1468409471.0,1475578918
