,author,subreddit,subreddit_id,title,author_created_utc,created_utc
2318,bidonv,oil,t5_2qhl1,Land deal finalized in preparation for Tanzania LNG project,1447181671.0,1454267998
2319,michaelconfoy,oil,t5_2qhl1,"Sugar Creek refinery, Missouri, Standard Oil Company of Indiana, July 29, 1909.",1398224312.0,1454278562
2320,Steffy_Berlin,oil,t5_2qhl1,Oil Crops Agriculture products b2b suppliers buyers in Chennai India | bizbilla,1451033412.0,1454317239
2321,OffshorePost,oil,t5_2qhl1,Statoil To Start Oil Exploration Offshore Uruguay,1450192233.0,1454319174
2322,Ozzy564,oil,t5_2qhl1,Oil crash is kicking off one of the largest wealth transfers in human history,1434105135.0,1454321585
2323,OffshorePost,oil,t5_2qhl1,Bristow Wins Statoil Contract Worth $115 Million,1450192233.0,1454323480
2324,newsmaritime,oil,t5_2qhl1,Statoil extend offshore oil operations in Uruguay,1451383076.0,1454323622
2325,GeoStarRunner,oil,t5_2qhl1,US to stop approving oil fracking off California coast until review is complete,1419441235.0,1454343249
2326,GeoStarRunner,oil,t5_2qhl1,Investors in thriving European oil refineries on alert for turning point,1419441235.0,1454359523
2327,dufosho,oil,t5_2qhl1,Oil industry worker speaks his mind,1429922233.0,1454366422
2328,OffshorePost,oil,t5_2qhl1,BP Suffers $2.2 Billion Loss As Oil Slump Continues To Bite,1450192233.0,1454403348
2329,neritam,oil,t5_2qhl1,"UK Government Bails Out North Sea; Gives ""Nothing to Solar” - Oil Change International",1453540358.0,1454412857
2330,corokdva,oil,t5_2qhl1,Understanding the Plunge in Oil Prices: Sources and Implications,1434680571.0,1454434693
2331,itaborai83,oil,t5_2qhl1,Oil: Could Prices Jump 50% by the End of 2016?,1124510400.0,1454459412
2332,fxcentral,oil,t5_2qhl1,"Forecast and Technical Analysis of the Crude Oil Futures on February 03, 2016!",1452520570.0,1454501199
2333,onlynickcarter,oil,t5_2qhl1,Palm Oil Market to Witness Stable Growth During 2015 - 2020,1452838146.0,1454501998
2334,Annrosans,oil,t5_2qhl1,Oil-rich Venezuela is now importing U.S. oil,1430740715.0,1454559348
2335,workerbotsuperhero,oil,t5_2qhl1,"Episode 681: The Oil Kingdom : Planet Money : NPR - ""...the price of oil has plummeted, and Saudi Arabia is scrambling to adapt. """,1385335068.0,1454569232
2336,OffshorePost,oil,t5_2qhl1,Statoil Losses Worsen With More Cuts Looking Likely,1450192233.0,1454583769
2337,Kysons_Brennen1,oil,t5_2qhl1,US oil extends losses after inventory data,1453979614.0,1454589467
2338,dgusovsky,oil,t5_2qhl1,Russia may be the wild card in the oil glut,1334079571.0,1454601715
2339,bidonv,oil,t5_2qhl1,MX Oil to Sell Nigerian Asset,1447181671.0,1454603403
2340,rserrano263,oil,t5_2qhl1,Info about oil prices fall,1454587468.0,1454606426
2341,putsomecolourson,oil,t5_2qhl1,Price of oil,1390926031.0,1454606809
2342,TexasNorth,oil,t5_2qhl1,Hussein Obama just proposed a $10/barrel 'oil tax' to fund green energy transportation,1392476684.0,1454620190
2343,zphdbblbrx,oil,t5_2qhl1,White House wants $10 per barrel fee on oil,1250870960.0,1454623066
2344,3xpendableyouth,oil,t5_2qhl1,What Is Happening to the Price of Oil?,1442159455.0,1454639647
2346,Semaug,oil,t5_2qhl1,Why can't the oil price just be raised by companies or the US government?,1385852694.0,1454661148
2347,Hitno,oil,t5_2qhl1,"30.000 Norwegian oil jobs have gone, and more might be on the way (article in Norwegian)",1347825198.0,1454665199
2348,aayushjindal,oil,t5_2qhl1,Global Oil Prices Harsh Reality: Canada ‘Unsustainable’,1397551976.0,1454669100
2349,Petroplan,oil,t5_2qhl1,"Infographic for the Talent Insight Index 2016: An annual barometer for the Oil, Gas and Energy Industry",1454670392.0,1454670512
2350,OffshorePost,oil,t5_2qhl1,Statoil To Stop Njord and Hyme Oil Production,1450192233.0,1454676038
2351,whereshouldthekid,oil,t5_2qhl1,Five Theories on Why Oil Prices are Plummeting,1446818918.0,1454681752
2352,aayushjindal,oil,t5_2qhl1,"Asian Crude Oil Prices More Solid, Reason?",1397551976.0,1454683097
2353,eleitl,oil,t5_2qhl1,The IEA's Oil Production Predictions for 2016,1157554356.0,1454684036
2354,biokemau,oil,t5_2qhl1,hot-oil-flushing,1414779943.0,1454692877
2355,whereshouldthekid,oil,t5_2qhl1,"Falling Oil Prices Are Making This ""Middleman"" Company Rich",1446818918.0,1454703013
2356,braddoge,oil,t5_2qhl1,looking for teamspeak (or equivalent) channel for oil traders,1389821780.0,1454740932
2357,minidw,oil,t5_2qhl1,"As prices drop, what challenges do oil companies face and what focus should they keep going foward?",1306769733.0,1454772851
2358,Bizkitgto,oil,t5_2qhl1,Shell postpones final investment decision on Kitimat LNG project,1420276176.0,1454784214
2359,Naiqmaana,oil,t5_2qhl1,"In Fort McMurray, anxiety and hope as oil woes deepen",1430907197.0,1454821226
2360,angela203,oil,t5_2qhl1,Biokem ruler oil analysis,1421265083.0,1454845808
2362,eleitl,oil,t5_2qhl1,Oil Production Is Going To Drop And Oil Prices Are Likely To Increase,1157554356.0,1454864546
2364,michaelconfoy,oil,t5_2qhl1,"California Limited Oil field, Fresno County, 1909.",1398224312.0,1454874883
2365,stumo,oil,t5_2qhl1,Oil Prices Rise 6% After Alberta Oil Workers Accidentally Unleash Balrog [humor],1212099479.0,1454900287
2366,OffshorePost,oil,t5_2qhl1,Giant Total Offshore Gas Development Starts Up,1450192233.0,1454929770
2367,fxcentral,oil,t5_2qhl1,"Forecast and Technical Analysis of the Crude Oil Futures on February 08, 2016",1452520570.0,1454930561
2368,edyang73,oil,t5_2qhl1,New Unloader Valve Invented for Oil &amp; Gas Compressors,1355767984.0,1454949201
2369,rupierupe,oil,t5_2qhl1,Chesapeake and Linn Energy each plummeted nearly 50% over the weekend.,1426116229.0,1454963409
2370,lockymrv,oil,t5_2qhl1,Tracking the Internet of Things in the oil industry.,1420889867.0,1454968017
2371,ninthinning01,oil,t5_2qhl1,BHI: US rig count plummets 48 units in biggest decline in months - Oil &amp; Gas Journal,1408990419.0,1454981130
2372,lockymrv,oil,t5_2qhl1,Cloud computing meets the oil and gas sector - it's about time.,1420889867.0,1454989959
2373,KC_OIL,oil,t5_2qhl1,How to trade oil?,1455011335.0,1455011397
2374,OCDIndian,oil,t5_2qhl1,"Oil price recovery will be short-lived, says IEA (on the back of Brent falling 6% today)",1455038095.0,1455040776
2375,rimz101,oil,t5_2qhl1,Why is U.S. oil dropping today?,1454356233.0,1455041919
2376,soundofprofound,oil,t5_2qhl1,Iran No Longer Accepting Dollars for Oil; Demanding Euros Instead,1432841207.0,1455055120
2377,stumo,oil,t5_2qhl1,Daily chart: Adjusting the taps on oil price | The Economist,1212099479.0,1455072416
2378,bharatbooks,oil,t5_2qhl1,South Africa Oil and Gas Report,1314005515.0,1455078186
2379,stylesatlife,oil,t5_2qhl1,How to use Peppermint Oil for Hair Growth,1402370756.0,1455083722
2380,fxcentral,oil,t5_2qhl1,"Forecast and Technical Analysis of the Crude Oil Futures on February 10, 2016",1452520570.0,1455095991
2381,OffshorePost,oil,t5_2qhl1,Oil Price Hopes After Iran Hints At Saudi Negotiations,1450192233.0,1455097961
2382,OffshorePost,oil,t5_2qhl1,Shell Sells North Sea Oil Field For Undisclosed Fee,1450192233.0,1455108817
2383,eleitl,oil,t5_2qhl1,OPEC January Production - Peak Oil Barrel,1157554356.0,1455129984
2384,stumo,oil,t5_2qhl1,"Stung by Low Oil Prices, Companies Face a Reckoning on Debts - The New York Times",1212099479.0,1455146305
2385,itaborai83,oil,t5_2qhl1,Bloomberg: The Numbers Don't Lie: Oil Storage Levels in the U.S.,1124510400.0,1455153032
2386,OffshorePost,oil,t5_2qhl1,Technip Win Subsea Work With Oil Major Statoil,1450192233.0,1455183226
2387,infodataplaces,oil,t5_2qhl1,Opportunities for Oil Leads,1452089687.0,1455184757
2388,OffshorePost,oil,t5_2qhl1,National Oilwell Varco Secure Rockhopper SURF,1450192233.0,1455185780
2389,OffshorePost,oil,t5_2qhl1,More Safety Breaches At ENI Goliat Arctic Oil Field,1450192233.0,1455188724
2390,Nigerianvisa1,oil,t5_2qhl1,Employment Within The Oil &amp; Gas Trade in Nigeria,1437066672.0,1455204445
2391,Tyler_Currie,oil,t5_2qhl1,US Oil Sands hits pause on project in eastern Utah. Familiar explanation: low prices,1455134890.0,1455213277
2392,ctkearney,oil,t5_2qhl1,Oil giant Husky lays off hundreds at Calgary office,1455215558.0,1455215892
2393,bharatbooks,oil,t5_2qhl1,China: Crude Petroleum Oil - Market Report. Analys,1314005515.0,1455248469
2394,DevidJohnson5,oil,t5_2qhl1,Oil is Cheap,1453170302.0,1455248735
2395,ninthinning01,oil,t5_2qhl1,Initial production rates in tight oil formations continue to rise,1408990419.0,1455252468
2396,ninthinning01,oil,t5_2qhl1,BP outlook: American shale gas revolution to go global by 2035,1408990419.0,1455252523
2397,greenReptar,oil,t5_2qhl1,China Turns a Glut of Oil Into a Flood of Diesel,1410706787.0,1455254492
2398,OffshorePost,oil,t5_2qhl1,Premier Oil Scraps Drilling Rig With Immediate Effect,1450192233.0,1455267751
2399,eleitl,oil,t5_2qhl1,Why the Wild Descent of Oil Is Cause for Concern,1157554356.0,1455269515
2400,OffshorePost,oil,t5_2qhl1,Offshore Gas Discovery For Woodside Petroleum,1450192233.0,1455282722
2401,OffshorePost,oil,t5_2qhl1,Heerema Wins Statoil Contract For Oseberg Fabrication,1450192233.0,1455296086
2402,Semaug,oil,t5_2qhl1,Why didn't US. oil companies just store the extra oil to avoid oversupply?,1385852694.0,1455310087
2403,hollybollybuzz,oil,t5_2qhl1,Oil Prices Oil News and Oil Futures,1446554056.0,1455357531
2404,DavAbby1,oil,t5_2qhl1,"U.S. oil hits 12-year low on stockpile surge, risk aversion",1453368965.0,1455362007
2405,Fletcheaum,oil,t5_2qhl1,OPEC members call for emergency meeting on oil,1434171412.0,1455365860
2406,berodrigues,oil,t5_2qhl1,"Hey /r/oil, I made a video about the corruption scandal involving Brazilian NOC Petrobras. Did you know about it and what do you think?",1278375089.0,1455467437
2407,german-Analist,oil,t5_2qhl1,Retail Oil Investors get Burned,1443679673.0,1455524056
2408,OffshorePost,oil,t5_2qhl1,Forsys Subsea Wins Statoil Åsgard Contract,1450192233.0,1455531429
2409,OffshorePost,oil,t5_2qhl1,Expro Boss Quits Offshore Oil And Gas industry For BAE,1450192233.0,1455537474
2410,gkantchev,oil,t5_2qhl1,Oil Price Fears Weigh on European Banks,1336654035.0,1455540578
2411,hollybollybuzz,oil,t5_2qhl1,What are Oil Futures and how Oil Futures Work?,1446554056.0,1455565188
2412,luessidino,oil,t5_2qhl1,Best Olive Oil for Skin Care,1441447374.0,1455605383
2413,budgetstore,oil,t5_2qhl1,All You Need To Know About Sandhi Sudha Oil,1455607210.0,1455607394
2414,TheSuicidalSheep,oil,t5_2qhl1,"Saudi, Russian Oil Ministers Plan Talks in Doha Tuesday",1444382180.0,1455611543
2415,TheSuicidalSheep,oil,t5_2qhl1,Saudi Arabia and Russia Agree Oil-Output Freeze in Qatar,1444382180.0,1455615281
2416,OffshorePost,oil,t5_2qhl1,Ocean Rig Hits Out At Premier Oil With $63m Demand,1450192233.0,1455621650
2417,eleitl,oil,t5_2qhl1,One-Third of Oil Companies Could Go Bankrupt this Year,1157554356.0,1455629079
2418,Rebest,oil,t5_2qhl1,How Much Oil Does Islamic State Have and Who Buys it ?,1439933813.0,1455632672
2419,SOSCalifornia,oil,t5_2qhl1,AMERICAN SEEP STORY: HOTEL | Oil Platform shutdown causes increased tar on the Beach,1445298247.0,1455647063
2420,OffshorePost,oil,t5_2qhl1,First Oil Achieved From Petrobras Campos FPSO,1450192233.0,1455649146
2421,Real_MikeCleary,oil,t5_2qhl1,Iran voices disinterest in oil majors’ deal,1326252614.0,1455677383
2422,cureoils01,oil,t5_2qhl1,Affordable Clove Essential Oil,1455704586.0,1455704681
2423,OffshorePost,oil,t5_2qhl1,Renewed Oil Price Hopes After OPEC Russia Pact?,1450192233.0,1455705232
2424,Petroplan,oil,t5_2qhl1,"Talent Insight Index 2016 Video Infographic showing People's views of the Oil, Gas and Energy Industry",1454670392.0,1455710680
2425,biokemau,oil,t5_2qhl1,oil recycling Australia | condition monitoring Australia | oil rejuvenation Australia | Biokem,1414779943.0,1455713162
2426,michaelconfoy,oil,t5_2qhl1,"OPEC Tries To Freeze Oil Output, But Most Say Effort Will Melt Away",1398224312.0,1455726522
2427,OffshorePost,oil,t5_2qhl1,Ensco Wins Drilling Work With Oil Major Chevron,1450192233.0,1455732182
2428,ModernWallStreet,oil,t5_2qhl1,"Iran's Oil Minister Opens Up &amp; Crude Surges +6% - Commodities Report: February 17, 2016",1451526686.0,1455736929
2429,pinetree321,oil,t5_2qhl1,Surging Cruz Is Big Oil's New Crush as Donors Cool to Bush,1451547522.0,1455768353
2430,eleitl,oil,t5_2qhl1,"Bakken December Data, Big Decline - Peak Oil Barrel",1157554356.0,1455777277
2431,OffshorePost,oil,t5_2qhl1,Issues Identified On Tullow Oil Jubilee FPSO Turret Bearing,1450192233.0,1455783665
2432,OffshorePost,oil,t5_2qhl1,Xcite Energy Gains North Sea Licence Extension,1450192233.0,1455789491
2433,german-Analist,oil,t5_2qhl1,"Smaller oil producers, first in line to be wiped out",1443679673.0,1455798787
2434,whereshouldthekid,oil,t5_2qhl1,"Venezuela's economy ""requires oil closer to $200 than $100.""",1446818918.0,1455802554
2435,ninthinning01,oil,t5_2qhl1,U.S. Shale Oil Resilience; What OPEC Didn't Expect?,1408990419.0,1455830159
2436,bidonv,oil,t5_2qhl1,Victoria Oil &amp; Gas secures interest in Cameroon’s Matanda block,1447181671.0,1455881296
2437,OffshorePost,oil,t5_2qhl1,Statoil Award NOK 1 Billion Of Maintenance Contracts,1450192233.0,1455884312
2438,Rebest,oil,t5_2qhl1,North Korea - Next Energy Superpower?,1439933813.0,1455887503
2439,OffshorePost,oil,t5_2qhl1,Video – New Marathon Oil Alba Platform Installation,1450192233.0,1455902131
2440,vfilipova,oil,t5_2qhl1,Russia has no plans to reduce oil production,1452196729.0,1455916633
2441,ninthinning01,oil,t5_2qhl1,Russia sees oil output slump in worst case amid OPEC talks,1408990419.0,1455917449
2443,kinggKhan12,oil,t5_2qhl1,"In a country where oil is everything, young Saudis are afraid of what a future with cheap and oil prices will mean.",1453070819.0,1456051813
2444,TexasNorth,oil,t5_2qhl1,Saudi spokesman says it has a nuclear bomb and 'may hold a test within weeks'. Say hi to $300 or $400 oil. (1:02),1392476684.0,1456089148
2445,sciencecow,oil,t5_2qhl1,Natural Gas Price Increase Inevitable in 2016,1419723709.0,1456100725
2446,TexasNorth,oil,t5_2qhl1,Young Saudis See Cushy Jobs Vanish Along With Nation’s Oil Wealth,1392476684.0,1456109997
2447,futuretrader,oil,t5_2qhl1,"February: Global oil supply growth plunging, with US taking biggest hit for now",1411972167.0,1456140993
2448,OffshorePost,oil,t5_2qhl1,Bankrupt First Oil North Sea Stake Taken By Cairn And EnQuest,1450192233.0,1456144564
2449,Sweetnam,oil,t5_2qhl1,Oil production in federal Gulf of Mexico projected to reach record high in 2017,1445962561.0,1456153089
2450,whereshouldthekid,oil,t5_2qhl1,Oil surges 6% on IEA's US shale outlook and rig data,1446818918.0,1456157459
2451,TomMiami10,oil,t5_2qhl1,15W40 Heavy Duty Motor Oil (5-Gal) Wholesale Prices,1456167377.0,1456167687
2452,newsmaritime,oil,t5_2qhl1,Oil production in USA will reach record in 2021 and currently growth at medium trend,1451383076.0,1456174345
2453,bgarrettglaser,oil,t5_2qhl1,Are We Witnessing the Start of a Paradigm Shift in Energy Politics?,1426352313.0,1456185230
2454,OffshorePost,oil,t5_2qhl1,Gas Leak Shuts Down North Sea Platform TAQA,1450192233.0,1456217794
2455,OffshorePost,oil,t5_2qhl1,Urgent Tax Cuts Required Says Oil &amp; Gas UK,1450192233.0,1456223644
2456,block210,oil,t5_2qhl1,Do the math: How Saudis can cut oil production,1454010585.0,1456237813
2457,gkantchev,oil,t5_2qhl1,Price-moving China oil trades fan concerns,1336654035.0,1456243858
2458,craigie1211,oil,t5_2qhl1,Perth (Scotland) well expert urges N. Sea oil industry to innovate to maximise economic recovery (MER),1426088184.0,1456245974
2459,robertcsugar,oil,t5_2qhl1,U.S. Economics of Oil,1369859752.0,1456247285
2461,oilpricenews,oil,t5_2qhl1,This Is What Will Cause A Lasting Oil Price Rally,1454090274.0,1456251217
2462,oilpricenews,oil,t5_2qhl1,Who Will Be Left Standing At The End Of The Oil War?,1454090274.0,1456255884
2463,german-Analist,oil,t5_2qhl1,How to lose money with oil investments: ETFs and ETNs,1443679673.0,1456304084
2464,JLRinc,oil,t5_2qhl1,"Oil falls 3% on Saudi comments, US stockpile data",1451741473.0,1456320679
2465,sailwinds,oil,t5_2qhl1,Why Oil Fell To $30,1443032213.0,1456325166
2466,FajitaCologne,oil,t5_2qhl1,Chesapeake Energy lost $2.2 billion in fourth quarter,1416511766.0,1456325880
2467,biokemau,oil,t5_2qhl1,Has your Lubricating Oil got Gas?,1414779943.0,1456335834
2468,heinsider,oil,t5_2qhl1,Oil Price Could Drop Into The Teens,1439944990.0,1456340049
2469,MarkWhittington,oil,t5_2qhl1,American oil and gas exports look to change the geopolitical order,1196808622.0,1456340321
2470,whiskeydeltatango,oil,t5_2qhl1,Oil up 3 pct as U.S. gasoline demand trumps stockpile build,1309825934.0,1456341335
2471,oilpricenews,oil,t5_2qhl1,Glut Worsens as U.S. Oil Storage Levels Rise Again,1454090274.0,1456342234
2472,vfilipova,oil,t5_2qhl1,Shell became the second largest oil company in the world. After acquisition of BG Group market cap reached 177b USD,1452196729.0,1456347993
2473,oilpricenews,oil,t5_2qhl1,35% Of Public Oil Companies Could Face Bankruptcy,1454090274.0,1456356169
2476,bharatbooks,oil,t5_2qhl1,"Opportunities in Isolated, Marginal and Relinquished Oil &amp; Gas Blocks in India",1314005515.0,1456399508
2477,gkantchev,oil,t5_2qhl1,Big banks slash oil price forecasts,1336654035.0,1456400042
2478,eleitl,oil,t5_2qhl1,Oil Price And Its Effect On Production,1157554356.0,1456408931
2479,OffshorePost,oil,t5_2qhl1,Expro Wins Statoil Well Control And Subsea Contracts,1450192233.0,1456411539
2480,worldtidings,oil,t5_2qhl1,Motorcycle Oil Change in the West Palm Beach,1439293601.0,1456421558
2481,sciencecow,oil,t5_2qhl1,Origins of The Global Oil Price Collapse,1419723709.0,1456431761
2482,oilpricenews,oil,t5_2qhl1,First U.S. LNG Shipment Departs…But Where Is It Going?,1454090274.0,1456441309
2483,oilpricenews,oil,t5_2qhl1,Why Oil Booms And Busts Happen,1454090274.0,1456441676
2484,janesheebamedia,oil,t5_2qhl1,Why Vegetable oils are harmful to your health?,1399273724.0,1456457642
2485,tellman1257,oil,t5_2qhl1,Oil Extends Decline as Saudi Arabia AND Iran Resist Production Cuts,1315223332.0,1456475437
2486,gkantchev,oil,t5_2qhl1,Will U.S. gas exports lead to a price war with Russia in Europe?,1336654035.0,1456478982
2487,Marcellronk,oil,t5_2qhl1,"Oil Spills Into Yellowstone River, Possibly Polluting Drinking Water",1437654264.0,1456484676
2488,itaborai83,oil,t5_2qhl1,Watch Five Years of Oil Drilling Collapse in Seconds,1124510400.0,1456487081
2489,eleitl,oil,t5_2qhl1,Nigeria: Our Days of Oil Boom Are Gone - Buhari,1157554356.0,1456489058
2490,whereshouldthekid,oil,t5_2qhl1,Halliburton was responsible for laying off 3% of all U.S. energy workers last year,1446818918.0,1456503782
2491,Piepersef,oil,t5_2qhl1,4 reasons Saudi Arabia can't control oil,1442664935.0,1456577240
2492,Petrocrat,oil,t5_2qhl1,IHS outlook for oil &amp; gas industry trends [slideshow],1355878833.0,1456619118
2493,michaelconfoy,oil,t5_2qhl1,"Burkburnett, Texas oil field, 1919.",1398224312.0,1456677792
2494,financewires,oil,t5_2qhl1,Oman ready to cut oil production with 5-10% cope with low prices,1456174900.0,1456691398
2495,RVAHokie,oil,t5_2qhl1,(x-post)[Bloomberg][youtube Video]Electric Cars Could Wreak Havoc on Oil Markets Within a Decade,1375914659.0,1456722284
2496,xCAPTAINxTEXASx,oil,t5_2qhl1,"Despite the current state of the oilfield, what company man school in TX would you recommend?",1385753587.0,1456723242
2497,bluemountainpea,oil,t5_2qhl1,The Best Cooking Oils for Your Health,1447755876.0,1456735952
2498,Roccaa2Janiyah4_,oil,t5_2qhl1,Alberta Energy to discuss cyberthreats on oil and gas infrastructure,1455284140.0,1456750316
2499,Sweetnam,oil,t5_2qhl1,Canadian oil production expected to increase despite lower prices,1445962561.0,1456756599
2500,eleitl,oil,t5_2qhl1,US Oil Rig Count Points To A Sharp Decline In Production,1157554356.0,1456757519
2501,sciencecow,oil,t5_2qhl1,What Really Controls Oil Prices?,1419723709.0,1456759523
2502,gkantchev,oil,t5_2qhl1,"50 oil tankers wait to unload cargo in Rotterdam, most since 2009, in fresh sign of glut",1336654035.0,1456772706
2503,oilpricenews,oil,t5_2qhl1,The U.S. Still Dominates World Oil Prices,1454090274.0,1456773375
2504,oilpricenews,oil,t5_2qhl1,Oil Up On Positive Comments From Saudis,1454090274.0,1456775747
2505,Johnny_Big,oil,t5_2qhl1,"THEY SAID COCONUT OIL WAS GREAT FOR YOU, BUT THIS IS WHAT THEY DIDN’T TELL YOU",1455838249.0,1456779152
2506,CommanderStarkiller,oil,t5_2qhl1,"Following the Oil Crash, has made me better at job finding",1448305976.0,1456798064
2507,Cibotak,oil,t5_2qhl1,Oil and Gas Vacancy – pelatihan gas nusantara,1407312237.0,1456807271
2508,angela203,oil,t5_2qhl1,BioKem Oil Services and OFS meeting the Gold Standard for oil filtration,1421265083.0,1456807291
2509,biokemau,oil,t5_2qhl1,Case Study - Power Station Steam (Boiler) Feed Pump Lube Oil,1414779943.0,1456841856
2510,oilpricenews,oil,t5_2qhl1,Gulf Stock Markets Feel The Pain From Low Oil Prices,1454090274.0,1456853281
2511,bvwilson58,oil,t5_2qhl1,"New Husky Energy plants will create 90 permanent, 500 construction jobs",1376242579.0,1456870313
2513,evans95,oil,t5_2qhl1,cannabidiol oil,1456812751.0,1456920626
2514,Pompeiayl,oil,t5_2qhl1,Shale Oil Isn't Saudi Arabia's Only Nemesis,1434960044.0,1456920671
2515,gkantchev,oil,t5_2qhl1,Hedge Funds Turn Bullish on Oil Despite Glut,1336654035.0,1456926909
2516,OffshorePost,oil,t5_2qhl1,Crude Oil Price Up As Governments Schedule Meeting,1450192233.0,1456947319
2517,Kevinsparks101,oil,t5_2qhl1,Dead Sea Magnesium Oil,1456992276.0,1456992372
2518,ninthinning01,oil,t5_2qhl1,Saudi Arabia faces new oil titan if it wins shale battle,1408990419.0,1457002515
2519,OffshorePost,oil,t5_2qhl1,Lundin Discovers Significant Offshore Gas,1450192233.0,1457003272
2520,amiliasummer14,oil,t5_2qhl1,Thyme Essential Oil,1423217980.0,1457008889
2521,leenur,oil,t5_2qhl1,Yergin Sees Output Freeze Restoring Balance to Global Oil Market,1395555413.0,1457010347
2522,synthesismatters,oil,t5_2qhl1,History of offshore oil extraction – timeline,1452118959.0,1457043165
2523,ninthinning01,oil,t5_2qhl1,BHI: US rig count nearing lowest level in generations - Oil &amp; Gas Journal,1408990419.0,1457065743
2524,Andridegk,oil,t5_2qhl1,Crude prices climb after US oil output falls for sixth week,1442559488.0,1457088489
2525,OffshorePost,oil,t5_2qhl1,Legal Action Over FPSO Contract Cancellation,1450192233.0,1457107009
2526,OffshorePost,oil,t5_2qhl1,Drilling Rigs Scrapped From North Sea By Statoil,1450192233.0,1457110029
2527,Tyler_Currie,oil,t5_2qhl1,"One Man's Story: An Interview with Stephen Lebel, a Laidoff Oilworker.",1455134890.0,1457115927
2528,oilpricenews,oil,t5_2qhl1,Ultra-Bearish Headlines As A Contrarian Signal For Oil,1454090274.0,1457122699
2529,Grineflip,oil,t5_2qhl1,Why are the biggest producers of oil not the ones with the largest reserves?,1409799449.0,1457132195
2530,itsrattlesnake,oil,t5_2qhl1,One of the dumbest things I've ever seen someone say about oil on Reddit.,1294862738.0,1457143664
2531,acupoftwodayoldcoffe,oil,t5_2qhl1,"‘Peak Oil’ Over, Economists Study Climate Policy Costs. ""Worldwide oil and gas reserves steadily crept upward for decades while Presidents from Nixon to Carter assured everyone that the end of the oil was in sight""",1434273909.0,1457173762
2532,biokemau,oil,t5_2qhl1,How to Increase the Longevity of your Lube Oil,1414779943.0,1457201140
2533,wellsite,oil,t5_2qhl1,How a new sales model will benefit oilfield service companies and independent operators,1457186501.0,1457209356
2534,Cassicrein,oil,t5_2qhl1,"Global Shares, Oil Set For Bumper Week as Payrolls Near",1430738204.0,1457253498
2535,michaelconfoy,oil,t5_2qhl1,"Oil fields. Kern County, California, 1938.",1398224312.0,1457299939
2536,ninthinning01,oil,t5_2qhl1,Will Fossil Fuel Prices Fully Recover?,1408990419.0,1457315249
2537,Semaug,oil,t5_2qhl1,Why can't US oil companies all work together to limit supply?,1385852694.0,1457328483
2538,sayed12345,oil,t5_2qhl1,Top 5 What Kind of Coconut Oil is Best - Which Coconut Oil is Best Revie...,1455990835.0,1457335362
2539,evanst95,oil,t5_2qhl1,hemp oil,1457328123.0,1457340094
2540,OffshorePost,oil,t5_2qhl1,COSL Drilling Legal Action Threat Against Statoil,1450192233.0,1457345911
2541,sciencecow,oil,t5_2qhl1,"Oil Prices Should Fall, Possibly Hard",1419723709.0,1457350542
2542,wellsite,oil,t5_2qhl1,Here is a better way to get bids for oilfield services,1457186501.0,1457354921
2543,Shintaroshihar,oil,t5_2qhl1,"Oil rout over, OPEC aims for $50 anchor, says PIRA's Ross",1433830735.0,1457356339
2544,OffshorePost,oil,t5_2qhl1,Exceed Win North Sea Decom Work From Fairfield Energy,1450192233.0,1457356610
2545,bvwilson58,oil,t5_2qhl1,"This time last year, oil rallied from ~$48/bbl in late February, to ~$60/bbl in June before crashing",1376242579.0,1457382928
2546,oilpricenews,oil,t5_2qhl1,Will Russia End Up Controlling 73% of Global Oil Supply?,1454090274.0,1457384346
2547,biokemau,oil,t5_2qhl1,Moisture could be your No. 1 Lube Oil Problem,1414779943.0,1457403452
2549,OffshorePost,oil,t5_2qhl1,Statoil Abusing COSL Fatality Claim Norwegian Unions,1450192233.0,1457434836
2550,joeiles,oil,t5_2qhl1,Thought peak oil was a myth? Time to think again.,1357647328.0,1457447834
2551,oilpricenews,oil,t5_2qhl1,"Beware Investors: Oil Fundamentals Could Cause Oil Prices To Fall, Fast.",1454090274.0,1457462121
2553,Anthonyiak,oil,t5_2qhl1,Oil prices may drop to $25/barrel: Moody’s,1434973046.0,1457512556
2554,OffshorePost,oil,t5_2qhl1,Brent Crude Oil Surges Back Above $40 A Barrel,1450192233.0,1457545473
2555,thrashmo92,oil,t5_2qhl1,Norway expects its oil production to decline in 2016 — official,1441227626.0,1457545811
2557,gkantchev,oil,t5_2qhl1,Twitter Deletes Oil-Data Tweets Following Industry Complaints,1336654035.0,1457602692
2558,craigie1211,oil,t5_2qhl1,Wind and oil great mix north sea,1426088184.0,1457623115
2559,OffshorePost,oil,t5_2qhl1,Successful Production Test At Giant Zohr Gas Field,1450192233.0,1457638104
