,author,subreddit,subreddit_id,title,author_created_utc,created_utc
0,eks,oil,t5_2qhl1,BBC: Oil prices have risen in the UK and US after continued unrest in Libya and worries about the impact on the country's crude exports.,1173368505.0,1298413989
1,EvilV,oil,t5_2qhl1,Crude Oil Projections Causing Investors To Bet On Oil,1257521418.0,1299091208
2,EvilV,oil,t5_2qhl1,Libya is getting worse.  Oil prices climb.,1257521418.0,1299282848
3,Joel_gh719,oil,t5_2qhl1,Looking for information on the oil drilling process.,1253597369.0,1299537003
4,soccer,oil,t5_2qhl1,Middle East Events Drives Oil Speculation,1190247728.0,1300044305
5,simitpatel,oil,t5_2qhl1,Why Oil is Going to $120 -- Soon,1221786324.0,1300898168
6,venturep,oil,t5_2qhl1,Indiana Bones? Alberta's oil industry digs up more than black gold ,1301509443.0,1302276391
7,jimmycabo,oil,t5_2qhl1,VIDEO: T. Boone Pickens on the New Natural Gas Vehicle Act,1170268405.0,1302528925
8,jimmycabo,oil,t5_2qhl1,"$4 Gasoline, Again",1170268405.0,1302630012
9,jimmycabo,oil,t5_2qhl1,Are Oil Prices Driven by Speculators?,1170268405.0,1302738077
10,dexcel,oil,t5_2qhl1,"Gas is great, but can it make money? | The Oil and the Glory",1273344296.0,1307013121
11,jack-mihoff,oil,t5_2qhl1,"Can anyone enlighten me on the history of the word ""spud"" in the oil industry?",1275706749.0,1307063158
12,viralmp3,oil,t5_2qhl1,"Mexican official: Thieves stole $250 million in oil in 4 months, cartels involved",1304912332.0,1308275869
13,yourpalharvey,oil,t5_2qhl1,"Eni Leads Libya Oil Race; Rebels Warn Russia, China",1235236951.0,1314032650
14,soccer,oil,t5_2qhl1,"Iraq’s New Oil Contract: Grand Theft and Local 
Collusion",1190247728.0,1315358112
15,soccer,oil,t5_2qhl1,Iraq’s New Oil Contract (II): Sectarian Spoils,1190247728.0,1315535304
16,soccer,oil,t5_2qhl1,Iran Oil Revenue Hits Record High,1190247728.0,1315716562
17,realthrowaway,oil,t5_2qhl1,Any experts on asphaltene in live oil?,1313934955.0,1315742697
18,ashiinvestments,oil,t5_2qhl1,"Oil Weekly Analysis, Sept 25, 2011 | Ashi Investments - Daily Analysis, Investment and Business Articles",1314116952.0,1316969486
19,ashiinvestments,oil,t5_2qhl1,"Oil Daily Analysis, Sept 26, 2011 | Ashi Investments - Daily Analysis, Investment and Business Articles",1314116952.0,1317051064
20,puteto,oil,t5_2qhl1,"Oil Daily Analysis, Sept 27, 2011 | Ashi Investments - Daily Analysis, Investment and Business Articles",1317130589.0,1317138968
21,puteto,oil,t5_2qhl1,"Oil Daily Analysis, Sept 30, 2011 | Ashi Investments - Daily Analysis, Investment and Business Articles",1317130589.0,1317395183
22,adring,oil,t5_2qhl1,Oil in Bakken area,1196356339.0,1321580770
23,sapthagiriindustries,oil,t5_2qhl1,"Insulating Oil Machine Manufacturers 



",1322198523.0,1322198580
24,ainsmag,oil,t5_2qhl1,Gas Oil Removed From Power Station With Full Environmental Safeguards,1222166895.0,1323196391
25,biz_dara,oil,t5_2qhl1,Virgin Coconut Oil,1324643552.0,1324643771
26,rfinberg,oil,t5_2qhl1,Huge Oil Find - But.. will only last 38 days,1323635447.0,1324844190
28,angeliefyu,oil,t5_2qhl1,Kerosene Oil Price,1327562866.0,1327562988
29,khalilalzoghbi,oil,t5_2qhl1,Oil prices jump after Iran says is cutting cut flow to EU,1317093213.0,1329330582
30,jfoust2,oil,t5_2qhl1,"This year, natural gas prices may reach... zero?",1283445230.0,1330054062
31,TanBoonTee,oil,t5_2qhl1,BBC News - Oil price jumps to 43-month high on Saudi blast reports,1241235970.0,1330663301
32,thetgbreport,oil,t5_2qhl1,Why is gasoline and Diesel so expensive?,1328288393.0,1331061601
33,svenus,oil,t5_2qhl1,Rainbow points to oil rig,1303614770.0,1331588987
34,need-writers,oil,t5_2qhl1,Looking for writers - no experience needed in writing - just need oil content for mag coming out of ND,1332250422.0,1332250690
35,daddyfry,oil,t5_2qhl1,"Seriously, is there anything that could be done about gas prices?",1332533567.0,1332533748
36,anomoleee,oil,t5_2qhl1,Weren't gas prices higher during The Bush Years?,1332540353.0,1332545216
37,miraz019,oil,t5_2qhl1,Oil based massages must try this summer | THE BD TODAY,1269893003.0,1335776176
38,trondsundt,oil,t5_2qhl1,10 Beautiful pictures from the offshore oil industry,1335668494.0,1336186359
39,antdude,oil,t5_2qhl1,"Microsubmarines could clean oil spills, researchers say",1282772991.0,1336448416
40,zazu1,oil,t5_2qhl1,"Blessing or Curse? Did Nationalizing Oil Help Brazil, Venezuela, Mexico?",1330563082.0,1336921496
41,vaivhav,oil,t5_2qhl1,Digboi is where the oldest running oil well exists!!!,1211960560.0,1337198293
42,html55,oil,t5_2qhl1,The Great Escape? Getting Ourselves Off Oil,1337756912.0,1337756946
43,ebrunoh,oil,t5_2qhl1,Kenyan Oil Crisis - what ought to be done differently,1337241356.0,1337847646
44,juliazhu,oil,t5_2qhl1,"Buy oil paintings, impressional oil painting, free shipping oil paintings, FREE shipping!High quality!100% handmade  buiding oil painting on canvas,oil painting wholesale, 20X24inch buiding paintings at Aliexpress.com",1338139274.0,1338139405
45,juliazhu,oil,t5_2qhl1,"Buy people oil painting, portrait oil painting, people painting, HIGH Quality! 100% handmade realism people oil painting on canvas,oil painting reproduction,oil painting wholesale at Aliexpress.com",1338139274.0,1338200088
46,masm501,oil,t5_2qhl1,What is the New Floor for Oil Prices?,1334402486.0,1338387296
47,sananton_by_day,oil,t5_2qhl1,Shale oil/gas reserves and output in United States,1337716733.0,1338408719
48,electricnyc,oil,t5_2qhl1,Why is this not getting more attention? A Small Irish company have found oil in Nevada! They may have found a lot of oil in Nevada!,1251981715.0,1338800226
49,rcornish,oil,t5_2qhl1,Gas Hike Reason?  Why have some stations jumped by .30 for the past week and others have remained constant?,1288107026.0,1339426799
50,neweraoil2,oil,t5_2qhl1,"Gas Oil Suppliers, Red Diesel &amp; Domestic Heating Oil Prices UK - New Era Oil",1339834639.0,1339834896
51,neweraoil2,oil,t5_2qhl1,"Automotive Oils: Engine Oils, Gear Oils &amp; Greases for Cars &amp; Vans",1339834639.0,1340609617
52,mortenmost,oil,t5_2qhl1,New oil resources fuel skepticism in Norway,1275054730.0,1341392672
53,nadiasindi,oil,t5_2qhl1,"Mitt's Iran Oil Investments Left Out of His 2010 Returns, Why?",1223317724.0,1341815750
54,tbidon,oil,t5_2qhl1,But isn't oil ALWAYS the motive?,1337868191.0,1342454683
55,maggiej101,oil,t5_2qhl1,The World's 25 Biggest Oil Companies: Putin's Playthings - Forbes,1342481407.0,1342481491
56,neweraoil2,oil,t5_2qhl1,"Commercial Oils: Engine Oil, Gear Oil &amp; Grease for Lorries &amp; Trucks",1339834639.0,1343128743
57,neweraoil2,oil,t5_2qhl1,"Industrial Lubricants, Machine Lubricants &amp; Cutting Oils",1339834639.0,1343206920
58,xtnvieira,oil,t5_2qhl1,We have an addiction: to fuel,1336514294.0,1343406659
59,neweraoil2,oil,t5_2qhl1,"Plant and Machinery Oils: Engine Oil, Hydraulic Oil &amp; Compressor Oil",1339834639.0,1343722877
60,rojerwil,oil,t5_2qhl1,Olive Oil – Extra Virgin For Healthy Life | Organic x Benefits,1298539289.0,1343978226
61,shallah,oil,t5_2qhl1,Insight: Oil's big players raise the stakes in Iraqi Kurdistan,1220919695.0,1344194891
62,camphoroil,oil,t5_2qhl1,White camphor Oil - 101% pure camphor oil,1343280549.0,1344335183
63,cann4ing,oil,t5_2qhl1,"Oil Cartel: 'Sorry for the Inconvenience, Now Give Me Your Wallet!'",1239411770.0,1344469546
64,CambridgeHouse,oil,t5_2qhl1,"Oil Politics, Pipelines &amp; Conspiracy - Keith Schaefer, Oil &amp; Gas Investments Bulletin",1335817563.0,1344538061
65,forsythea,oil,t5_2qhl1,Moroccan oil,1297149112.0,1344698786
66,billyjaypeg,oil,t5_2qhl1,The hunt to unlock oil sands - Canada could be #1 in world oil reserves if it can unlock its oil-sands deposits,1339512538.0,1345209792
67,kisanrai75,oil,t5_2qhl1,morcon oil,1345547903.0,1345547973
68,doccuba,oil,t5_2qhl1,Guest Post: Venezuela Ramps up China Oil Exports Unsettling Washington | ZeroHedge,1345779883.0,1345780090
69,MikeSWR,oil,t5_2qhl1,The US Is More Dependent On Foreign Uranium Than Foreign Oil,1336090234.0,1347406146
70,8779897897,oil,t5_2qhl1,Tulip Oil versterkt zijn positie in Rhein Petroleum ,1347514312.0,1347598699
71,CambridgeHouse,oil,t5_2qhl1,Keith Schaefer on BNN talks about Fracking for Natural Gas and Oil,1335817563.0,1347644894
72,billyjaypeg,oil,t5_2qhl1,US Oil Production Expected to Rise 74% by 2022,1339512538.0,1348169957
73,MikeSWR,oil,t5_2qhl1,"Unearthing Profit-Makers in the Oil &amp; Gas Service Sector - ""We're looking at steadily higher oil prices going forward.""",1336090234.0,1348172546
74,zdgeraniumoil,oil,t5_2qhl1,geranium oil,1348538002.0,1348538459
75,peteholcomb,oil,t5_2qhl1,oil drunk,1348785126.0,1348845192
76,billyjaypeg,oil,t5_2qhl1,U.S. Pumps Most Oil Since 1997,1339512538.0,1350057973
77,evanmc,oil,t5_2qhl1,US may top Saudi Arabia as oil producing country,1347588721.0,1351042482
78,nadiasindi,oil,t5_2qhl1,US may soon become world's top oil producer - Wire - NewsObserver.com,1223317724.0,1351139987
79,MikeSWR,oil,t5_2qhl1,Africa and Kurdistan Show Great Oil and Gas Potential: Lionel Therond,1336090234.0,1351290924
80,TheFerretman,oil,t5_2qhl1,I-Team: Oil Discovered in Nevada,1269049715.0,1351345851
81,ucccft,oil,t5_2qhl1,U.S. to overtake Saudi as top oil producer: IEA,1294848738.0,1352753557
82,Nox97media,oil,t5_2qhl1,How the USA will pass Russia and Saudi Arabia as 'Oil KIng' by 2020,1352849813.0,1352850286
83,debianer,oil,t5_2qhl1,Penneco Oil Company Route 22,1262984449.0,1353426381
84,TheMrMFP,oil,t5_2qhl1,Governor Kasich Continues to Frame Fracking Tax Hike as Targeting “Big Oil” | RedState,1354346502.0,1354346764
85,Speedtarzanjujitsu,oil,t5_2qhl1,"The great rush: Government to give green light to mass exploration for shale gas
'Fracking' exploration could affect 60 per cent of UK, despite safety fears. [x-post from /r/worldnews]",1311785115.0,1354415773
86,MikeSWR,oil,t5_2qhl1,Weighing the Risks in International Oil Plays,1336090234.0,1355188221
87,ragincary24,oil,t5_2qhl1,olive oil benefits,1333008096.0,1355231705
88,MikeSWR,oil,t5_2qhl1,Porter Stansberry: End the Ban on US Oil Exports,1336090234.0,1355787163
89,Thrower12,oil,t5_2qhl1,Analyst predicts oil price to drop to $50 per barrel ,1349720752.0,1356024808
90,Shaydie,oil,t5_2qhl1,Green Oil Shale?,1335042839.0,1358445807
91,AurishaSsigahawver,oil,t5_2qhl1,Sell my oil royalties,1358746517.0,1358832898
92,MikeSWR,oil,t5_2qhl1,Trillions of dollars worth of oil found in Australian outback,1336090234.0,1359070321
93,oildependency,oil,t5_2qhl1,"1,030 barrels of oil per second.... our oil dependency",1361826218.0,1361829526
94,nadiasindi,oil,t5_2qhl1,"Happy 100th Birthday, Big Oil Tax Breaks",1223317724.0,1362253088
95,Vailhem,oil,t5_2qhl1,Who're the mods for /r/oil?,1173208600.0,1362829419
96,anitaleeagain,oil,t5_2qhl1,"Cheney Saw Iraq as a Delicious ""Additional Source of Oil"" | MichaelMoore.com",1346320454.0,1363543993
97,Predra,oil,t5_2qhl1,Olive oil for skin protection,1294173612.0,1363641682
98,victoriakatherine,oil,t5_2qhl1,Basics Of Natural Fuel Exploration And Why Frac Sand Is Future Of Extraction Process,1348471144.0,1363776301
99,projectOilsupporter,oil,t5_2qhl1,projectoil,1364473573.0,1364473728
100,kimgerly,oil,t5_2qhl1,Motorville : The Story About the USA's Oil Addiction,1271101435.0,1365048220
101,sh3lly,oil,t5_2qhl1,Arkansas oil spill taking a toll on the ecosystem,1365293051.0,1365527595
102,dorothywebb,oil,t5_2qhl1,Diesel Fuel Tank Cleaning,1295016786.0,1365573325
103,elissap,oil,t5_2qhl1,Didn't hear of the Arkansas Exxon Oil Spill? That's cause Exxon is controlling the media.,1365733528.0,1365733654
104,bharatbooks,oil,t5_2qhl1,Energy News,1314005515.0,1365842795
105,tobandyck,oil,t5_2qhl1,Manitoba's unreported oil spill,1336395102.0,1366031133
106,waltergladys,oil,t5_2qhl1,Jasmine Absolute Oil,1365405040.0,1366268107
107,dalipu,oil,t5_2qhl1,"Tianjin Dalipu Oil Country Tubular Goods Co., Ltd",1366768507.0,1366768560
108,pkouliev,oil,t5_2qhl1,Oil Price Forecast for 2013-2014: Falling Prices - Forbes,1297950126.0,1367612748
109,scrappy06doo,oil,t5_2qhl1,Got oil?,1365039437.0,1367692572
110,destinyolives23,oil,t5_2qhl1,Extra Virgin Olive Oil - Premium quality extra virgin olive oil,1368010654.0,1368010719
111,Wormspike,oil,t5_2qhl1,Research advice on the 1973 Oil Crisis,1353409873.0,1370003488
112,supplydirect,oil,t5_2qhl1,"Oil Absorbents, Oil Absorbent Pads, Mats, Socks &amp; Boom, Oil Sorbents | Supply Line Direct",1370106881.0,1372242170
113,orionshmorion,oil,t5_2qhl1,Noam Chomsky on role of US in oil control [3:00],1338798540.0,1373271857
114,tellman1257,oil,t5_2qhl1,"The most watched Russian music video of the week is a tribute to how oil changed Russian society - DJ Smash &amp; Vengerov &amp; Bobina feat. Matua &amp; Averin &amp; Kravets - ""Нефть"" (Oil) (The refrain is ""I love you, oil"")",1315223332.0,1374445590
115,carduchi,oil,t5_2qhl1,Carduchi Kurdistan Region Energy Briefings with Kurdish Views,1375371598.0,1375371619
116,hcassin,oil,t5_2qhl1,Indonesia arrests SKKMigas boss,1314606502.0,1376488759
117,jsgui,oil,t5_2qhl1,What are the major oil and gas installations in Saudi Arabia? What are the less major ones? Where are the best online sources of information on this topic?,1327571780.0,1380059164
118,pepsibwp,oil,t5_2qhl1,Analysis of Financial Statement of Pakistan State Oil Report - Come to Learn,1380185903.0,1380185998
119,ucccft,oil,t5_2qhl1,"Under Obama, U.S. Leads the World in Oil and Gas Productio",1294848738.0,1381702038
120,djstangl,oil,t5_2qhl1,"ND OIL PROD, FISCAL POLICY AND HIGHER EDUC AS OF 10/15/13",1233068999.0,1381937382
121,engineeringguy,oil,t5_2qhl1,Bitumen-oil so thick you can pick it up (x-post pics),1305675862.0,1385429346
122,rujul110,oil,t5_2qhl1,Semi and Full Synthetic Motor Engine Oil,1353913278.0,1385968400
123,DonScrub,oil,t5_2qhl1,"Pet Coke -- #4 In ""Top 10 Toxic Ingredients Used By The Fossil Fuel Industries"" Series | PlanetSave",1374077196.0,1386176722
124,NRGYMAN,oil,t5_2qhl1,"TIGHT OIL AND OIL SAND VERSUS SMALL DEEP WATER DEVELOPMENTS, SOME OBSERVATIONS",1386482397.0,1386482568
125,manomet676767,oil,t5_2qhl1,San Juan oil drilling heats up in N.M. Swift and Huntington explore in Colorado By Chuck Slothower Herald staff writer,1384706648.0,1386631728
126,maboulette,oil,t5_2qhl1,HUGE OIL FIND CALLED 'DEATH KNELL FOR OPEC',1201201385.0,1386681255
127,pyro3366,oil,t5_2qhl1,Spitting Image - Nigel Lawson On Oil,1336503421.0,1387145637
128,DavidBurpee,oil,t5_2qhl1,Research could help oilsands,1387042771.0,1387214528
129,David_Phillips,oil,t5_2qhl1,U.S. oil production will reach near record highs in 2016,1265267912.0,1387286735
130,PLHljk,oil,t5_2qhl1,"More Than Three Years Later, Oil From the Deepwater Horizon Persists in the Gulf",1387417858.0,1387417959
131,jewels100sm,oil,t5_2qhl1,(HD) World Without Oil - National Geographic Full Documentary,1276893535.0,1387523312
132,RAndrewOhge,oil,t5_2qhl1,So...WHY Does Big Oil Need $10 Billion In Subsidies,1339603108.0,1387820895
133,admm4,oil,t5_2qhl1,High Quality Q8 Oils at Tranzmile Australia,1386931564.0,1388843674
134,admm4,oil,t5_2qhl1,High Quality Q8 Oils at Tranzmile Australia,1386931564.0,1388847593
135,aboezee,oil,t5_2qhl1,amla oil,1389375650.0,1389385694
136,frizzoff,oil,t5_2qhl1,The Truth Behind Oils and Curls,1373986054.0,1390414276
137,RockemShockem,oil,t5_2qhl1,"Ship Leaves Libyan Rebel Port Carrying Oil, Official and Gunmen Say",1383803427.0,1394672593
138,funspirit,oil,t5_2qhl1,U.S. Agrees to Allow BP Back Into Gulf Waters to Seek Oil,1358554976.0,1394761070
139,RockemShockem,oil,t5_2qhl1,Iraq's Oil Output Surges to Highest Level in Over 30 Years,1383803427.0,1394863654
140,RockemShockem,oil,t5_2qhl1,Here's a cool breakdown of how crude oil is refined into all its commercial and industrial products,1383803427.0,1395004196
141,RockemShockem,oil,t5_2qhl1,The science of oil [comic],1383803427.0,1395099706
142,RockemShockem,oil,t5_2qhl1,Researchers find a way to use cheap metals like thallium and lead to trigger the conversion of natural gas to liquid alcohol (liquid fuel form),1383803427.0,1395101069
143,RockemShockem,oil,t5_2qhl1,A Detailed Guide on the Many Different Types of Crude Oil,1383803427.0,1395267850
144,Capitalism_Prevails,oil,t5_2qhl1,How much total oil reserves does the world have in in oil sands?,1388117246.0,1395616749
145,RockemShockem,oil,t5_2qhl1,The Schlumberger Oilfield Glossary: Your one stop shop for all terms in the Oil and Gas business,1383803427.0,1395979975
146,acnalia,oil,t5_2qhl1,Potential Crackdown on Russia Risks Also Punishing Western Oil Companies,1283949201.0,1396019433
147,Sumdrew,oil,t5_2qhl1,Are there 'pools of oil'? (It's misleading...),1396269175.0,1396287151
148,RockemShockem,oil,t5_2qhl1,"What is a ""pump jack"" or ""beam pump"" that I see at so many oil rigs?",1383803427.0,1396311658
149,rampetro,oil,t5_2qhl1,Industrial Lubricants Oil Suppliers in Chennai,1365578164.0,1396512194
150,Free_Joty,oil,t5_2qhl1,Asian Gas Demand Spawns Floating Superfactories,1371176566.0,1396543118
151,RockemShockem,oil,t5_2qhl1,Old math casts doubt on accuracy of oil reserve estimates,1383803427.0,1396567386
152,castoroillinks,oil,t5_2qhl1,"Castor oil is a humectant, meaning it has the ability to keep things moist",1396683525.0,1396683585
153,RockemShockem,oil,t5_2qhl1,"Semi-submersible oil rigs, a quick breakdown of what they are",1383803427.0,1396812154
154,krishna111111,oil,t5_2qhl1,"Essential oils suppliers,Organic Essential Oils",1396936212.0,1396946666
155,stevemoore179,oil,t5_2qhl1,Global Transformer Oil Market Segment Analyzed for future Reference in a New Report,1397038805.0,1397039205
156,RockemShockem,oil,t5_2qhl1,"For the ecofriendly crowd here's a bit on ""pyrolysis"" or how to make oil from biomatter like wood and agricultural waste",1383803427.0,1397104679
157,jgreen53,oil,t5_2qhl1,"The oil curse — how black gold makes countries more authoritarian, corrupt, and violent",1342024387.0,1397154081
158,RockemShockem,oil,t5_2qhl1,The 2013 energy flow Sankey diagram from Lawrence Livermore National Labs was just published. Xpost from /r/BusinessHub,1383803427.0,1397178631
159,RockemShockem,oil,t5_2qhl1,World map resized based on proven oil reserves,1383803427.0,1397438113
160,FrankCortese,oil,t5_2qhl1,Never Run Out of heating Fuel with Automatic Oil Delivery System,1394708121.0,1397453832
161,RockemShockem,oil,t5_2qhl1,Interesting new waterless hydraulic fracturing techneque using liquefied petroleum gas,1383803427.0,1397571711
162,RockemShockem,oil,t5_2qhl1,Active oil and gas wells in Texas as of 2012,1383803427.0,1397616298
163,kittynh,oil,t5_2qhl1,Woman engineer at oil and gas conference....what it is like over the years...,1374253338.0,1397773848
164,RockemShockem,oil,t5_2qhl1,Titan's Surface Organics Surpass Oil Reserves on Earth,1383803427.0,1397882452
165,RockemShockem,oil,t5_2qhl1,"""Thumper trucks"" and ""Vibroseis Trucks"" are one type of seismic sources that hit the ground causing a small shockwave underground to aid in seismic locating of oil and gas.",1383803427.0,1398302859
166,RockemShockem,oil,t5_2qhl1,Crude oil samples of varying color and viscosity fresh from a well,1383803427.0,1398304691
167,PUAskandi,oil,t5_2qhl1,PSV's and Oil Rigs! (Few pictures repeat themselves!),1326147939.0,1398308986
168,keshkinghairoil,oil,t5_2qhl1,Kesh King Hair Oil - Hair Problems ab chance hi nahin,1398355415.0,1398355460
169,RockemShockem,oil,t5_2qhl1,The Door to Hell - a 4 decade long natural gas burning crater in Turkmenistan,1383803427.0,1398615674
170,RockemShockem,oil,t5_2qhl1,Oil and gas traps - These are the rock formations we look for with seismic,1383803427.0,1398635464
171,dexcel,oil,t5_2qhl1,Red Adair Putting Out an Oil Well Explosion,1273344296.0,1398690342
172,saoce,oil,t5_2qhl1,Upstream oil and gas field engineer? What are my options next? How realistic is it to move into oil trading?,1378622563.0,1398734469
173,OneAndOnlyNacho,oil,t5_2qhl1,Why is oil in the Middle East so cheap to PRODUCE?,1387144841.0,1398899437
174,RockemShockem,oil,t5_2qhl1,Crude oil sweet/sour and API quality characteristics by country,1383803427.0,1398950840
175,AppearMissing,oil,t5_2qhl1,What major changes occurred over the past decade in the market for oil and natural gas with respect to their future outlooks?,1387301724.0,1399037837
176,RockemShockem,oil,t5_2qhl1,Oilfield safety consultant is doing an AMA right now!,1383803427.0,1399167143
177,ForcefulPorcupine,oil,t5_2qhl1,Nanoreporters tell 'sour' oil from 'sweet',1355794906.0,1399171334
178,musiu,oil,t5_2qhl1,Anglo-Iranian Oil Company vehicle 1950 in Iran [x-post r/historyporn],1388324814.0,1399236786
179,bvwilson58,oil,t5_2qhl1,Petro Engineering Student Here - is taking a job as a Field Technician - Oilfield Services @ WM a good summer move?,1376242579.0,1399305948
180,dexcel,oil,t5_2qhl1,"Sunrise in the oil sands [r/pics, u/anotheronedown]",1273344296.0,1399443198
181,dexcel,oil,t5_2qhl1,Oil Rig Steel Jacket [r/pics u/Hrim],1273344296.0,1399443287
182,crudeoiltrader,oil,t5_2qhl1,How a Big Cat Started Europe’s Addiction to Crude Oil,1283523404.0,1399488900
183,RockemShockem,oil,t5_2qhl1,"An interesting read about salt domes, and their effect on oil formations",1383803427.0,1399504393
184,dexcel,oil,t5_2qhl1,More info about salt domes : What happens when you accidently drill through one when looking for oil | Youtube.com,1273344296.0,1399561747
185,RockemShockem,oil,t5_2qhl1,Statoil Presents: The Power of the Possible,1383803427.0,1399605796
186,nrgpsseo,oil,t5_2qhl1,Treater Alberta | Oil Treater Alberta | Test Seperator Alberta,1394452341.0,1399637867
187,BranderChatfield,oil,t5_2qhl1,"PHOTOS: Oil booms and man camps, life in North Dakota",1312812778.0,1399654969
188,texanwill,oil,t5_2qhl1,"Heard you guys might like this--A Texaco crude oil tank blazes against the night after being struck by lightning. Near Houston, September 1972. Photo by Jim Olive",1324148903.0,1399663588
189,RockemShockem,oil,t5_2qhl1,"Damn, oil rigs are big",1383803427.0,1399770298
190,robgreeny,oil,t5_2qhl1,No end in sight for New Mexico's oil boom (ABQ JOURNAL),1394069812.0,1399794061
191,RockemShockem,oil,t5_2qhl1,Some weird oil correlations that make you think.... but not really,1383803427.0,1399849626
192,mrrussell1,oil,t5_2qhl1,Infographic on Houston - Aimed at Oil &amp; Gas workers... Any Houston heads want to give recommendations?,1358100012.0,1399972153
193,FrankCortese,oil,t5_2qhl1,Heating Oil and Propane Supplier in CT,1394708121.0,1399981201
194,RockemShockem,oil,t5_2qhl1,Debunking the myths about the origins of oil and where it comes from,1383803427.0,1400011189
195,wheeelman,oil,t5_2qhl1,Oil Services Startup,1384553654.0,1400080404
196,crudeoiltrader,oil,t5_2qhl1,New LNG Plant in North Dakota will Supply Oil and Gas Producers,1283523404.0,1400246837
197,why_why_zed,oil,t5_2qhl1,100 Years of Oil in Alberta (x-post r/calgary),1390250264.0,1400247071
198,mrrussell1,oil,t5_2qhl1,If you're looking to work out in Aberdeen. This guide shows some great bars/restaurants and things to do. Aimed at oil and gas workers.,1358100012.0,1400497199
199,emmageorge91,oil,t5_2qhl1,"Palmarosa Oil, Suppliers, Manufacturers of Indian Palmarosa Oil, Palmarosa Essential Oil",1378972405.0,1400571951
200,neshalchanderman,oil,t5_2qhl1,Millennials Spurning Silicon Valley for Dallas Oil Patch,1367950251.0,1400730725
201,montesanotoday,oil,t5_2qhl1,Oil Trains danger in Montesano Wa.,1400773669.0,1400773789
202,micrommonitor,oil,t5_2qhl1,Latin America Oilfield Rental Market,1400757012.0,1401100644
203,jknox1,oil,t5_2qhl1,"Unexpected outperformer in oil market – naphtha. It’s Russia’s business, Libya’s struggle",1400852664.0,1401307827
204,RockemShockem,oil,t5_2qhl1,Department of Energy Facilities Locations Across the US,1383803427.0,1401319536
205,ForcefulPorcupine,oil,t5_2qhl1,The depth of oil compared to lakes and oceans,1355794906.0,1401325114
206,burlinmessi,oil,t5_2qhl1,"Resin manufacturers in India provide latest price of polymer, crude oil etc...",1379066837.0,1401353325
207,RockemShockem,oil,t5_2qhl1,"Link to - I'm a homesick Canadian Oilfield worker, AMA",1383803427.0,1401716968
208,RockemShockem,oil,t5_2qhl1,How pumps and compressor stations get oil and gas from the field to your car.,1383803427.0,1401717652
209,cnclubricantoil,oil,t5_2qhl1,Gear Oil | CNC Lubricants,1401858611.0,1401858666
210,RockemShockem,oil,t5_2qhl1,"Who are you guys, and what part of the oil and gas world do you come from?",1383803427.0,1402010332
211,AvaTrade,oil,t5_2qhl1,The World's Five Most Important Oil Fields | Commodities,1343640887.0,1402227475
212,RockemShockem,oil,t5_2qhl1,Bitumen: How to mine for oil rather then pump it,1383803427.0,1402457982
213,andrewhiles,oil,t5_2qhl1,basil oil,1368691090.0,1402478390
214,bharatbooks,oil,t5_2qhl1,Oil Sands Industry in Canada 2020,1314005515.0,1402488608
215,RockemShockem,oil,t5_2qhl1,Steam-assisted gravity drainage: One way of getting oil sands out of the ground,1383803427.0,1402526720
216,REALST8MOGULS,oil,t5_2qhl1,What Would $150 Oil Mean Today?,1402342177.0,1402943563
217,relaxedtalent,oil,t5_2qhl1,Oil rig roustabout,1402629510.0,1403037904
218,AmberWalter,oil,t5_2qhl1,SPIT-Don't SWALLOW. OIL PULLING 101! &amp; 8 ways to UNCOMPLICATE your Life,1386642475.0,1403049157
219,RockemShockem,oil,t5_2qhl1,XKCD: How much of crude oil is actually dinosaurs?,1383803427.0,1403128288
220,RockemShockem,oil,t5_2qhl1,The Truth About Launching a Career in the Oil and Gas Industry,1383803427.0,1403224503
221,Vailhem,oil,t5_2qhl1,Could Estonia's oil shale bolster Europe's energy security?,1173208600.0,1403376090
222,amelliasantos07,oil,t5_2qhl1,Engine Oil Analysis,1403410516.0,1403410650
223,israelbizreg,oil,t5_2qhl1,Tamar gas fields creating international deals and Israeli millionaires,1402478240.0,1403425921
224,JCB218,oil,t5_2qhl1,Dr David Robson on oil and gas in Central Asia,1402474217.0,1403520403
225,alreadyfamous,oil,t5_2qhl1,A crude fact oil really doesn't care about Iraq,1403631827.0,1403716036
