,author,subreddit,subreddit_id,title,author_created_utc,created_utc
1153,SinopecUSA,oil,t5_2qhl1,NEW (Oil Price Per Gallon) Motor Oil Hydraulic Fluid Trans Antifreeze Coolant Grease,1432644249.0,1432649562
1154,laosurvey,oil,t5_2qhl1,A Closer Look At The World’s 5 Biggest Oil Companies,1358657701.0,1432654325
1155,SinopecUSA,oil,t5_2qhl1,"ISO 32 AW-32 Hydraulic Oil Fluid (ISO VG 32, SAE 10W)",1432644249.0,1432656932
1156,TomJensenMorgan1960,oil,t5_2qhl1,Leasing In the Oil Patch Is Stronger Than You Might Expect Right Now - Forbes,1423687616.0,1432659609
1157,wnose,oil,t5_2qhl1,Oil: a look at the Canadian sector,1197235209.0,1432659761
1158,EnriqueMilo,oil,t5_2qhl1,"As US oil production soars, so do pipeline accidents",1432669369.0,1432669440
1159,wnose,oil,t5_2qhl1,Iraq About to Flood Oil Market in New Front of OPEC Price War,1197235209.0,1432673903
1160,SinopecUSA,oil,t5_2qhl1,"AW Hydraulic Oil/Fluid ISO VG 46, SAE 10 - 55 Gallon Drum (Free Shipping)",1432644249.0,1432685281
1161,energent,oil,t5_2qhl1,"Oil is back on the rise, and traders try to predict a ceiling",1419797881.0,1432692985
1162,KarterPayton,oil,t5_2qhl1,Australian oil &amp; gas Industry converged for its annual conference hosted by the Australian Petroleum Production &amp; Exploration Association.,1432405355.0,1432698407
1163,TomJensenMorgan1960,oil,t5_2qhl1,Getting the Most Out of Your Oilfield Raster and LAS Data,1423687616.0,1432739482
1164,naturaltherapy1,oil,t5_2qhl1,Essential Oils Manufacturers Suppliers India,1415361755.0,1432791395
1165,naturaltherapy1,oil,t5_2qhl1,Amla Oil Manufacturers Suppliers India,1415361755.0,1432792055
1166,naturaltherapy1,oil,t5_2qhl1,Amla Oil Manufacturers Suppliers India,1415361755.0,1432793650
1167,naturaltherapy1,oil,t5_2qhl1,Cashew Oil Manufacturers Suppliers India,1415361755.0,1432796179
1168,naturaltherapy1,oil,t5_2qhl1,Cumin Oil Manufacturers Suppliers India,1415361755.0,1432796903
1169,aviation01,oil,t5_2qhl1,"Oil and Gas News, India | News On Oil and Gas | Oil and Gas Sector News",1429698261.0,1432798777
1170,naturaltherapy1,oil,t5_2qhl1,Ginger Oil Manufacturers Suppliers India,1415361755.0,1432799362
1171,naturaltherapy1,oil,t5_2qhl1,Jasmine Oil Manufacturers Suppliers India,1415361755.0,1432802243
1172,naturaltherapy1,oil,t5_2qhl1,Menthol Oil Manufacturers Suppliers India,1415361755.0,1432805778
1173,naturaltherapy1,oil,t5_2qhl1,Mint Oil Manufacturers Suppliers India,1415361755.0,1432806523
1174,naturaltherapy1,oil,t5_2qhl1,Natural Oil Manufacturers Suppliers India,1415361755.0,1432807952
1175,Epic_Phail,oil,t5_2qhl1,"Venezuela, Russia's Rosneft agree on $14 bln oil, gas investment",1312755845.0,1432827085
1176,TomJensenMorgan1960,oil,t5_2qhl1,More U.S. Oil Production Enhances U.S. Energy Security - Forbes,1423687616.0,1432851338
1177,biokemau,oil,t5_2qhl1,Removing Moisture From Lubricating Oils,1414779943.0,1432882021
1178,PaigeJordyn,oil,t5_2qhl1,"ENERGY Legislative Advising and Thought Leadership Initiatives, Experts Needed",1432324367.0,1432925669
1179,YehudaMilagros,oil,t5_2qhl1,Oil falls below $63 as dollar strengthens,1432934545.0,1432934655
1180,babbles_mcdrinksalot,oil,t5_2qhl1,Reliance close to selling stake in US shale gas JV,1355424282.0,1432935590
1181,babbles_mcdrinksalot,oil,t5_2qhl1,EIA Reports Bizarre Increase In U.S. Oil Production,1355424282.0,1432935919
1182,callumgg,oil,t5_2qhl1,The Tanker Market Is Sending a Big Warning to Oil Bulls,1313870617.0,1432983306
1183,SkylerVeronica,oil,t5_2qhl1,Oil prices managed a gain Thursday after weekly inventory data showed bigger-than-expected drops in crude and gasoline supplies,1432935061.0,1433000273
1184,TexasNorth,oil,t5_2qhl1,OPEC under siege as Isil threatens world's oil lifeline,1392476684.0,1433003516
1185,biokemau,oil,t5_2qhl1,Removing Moisture from Lubricating Oils.pptx download,1414779943.0,1433098206
1186,biokemau,oil,t5_2qhl1,Removing Moisture from Lubricating Oils - Download - 4shared,1414779943.0,1433098897
1187,GroovyLube,oil,t5_2qhl1,Looking for an oil &amp; gas related hat,1396997678.0,1433102983
1188,sarmadkhalid,oil,t5_2qhl1,B.C. activists oppose Shell’s Arctic oil ambitions,1432252097.0,1433103564
1189,Anna_Jack,oil,t5_2qhl1,Nigerian Oil Hurt by Tussle Between OPEC and U.S.,1427778520.0,1433140952
1190,gkantchev,oil,t5_2qhl1,What to expect for oil and OPEC the cartel's meeting this week?,1336654035.0,1433153456
1191,TomJensenMorgan1960,oil,t5_2qhl1,Using Creaming Curves to Compare Performance of Oilfield Operators - Forbes,1423687616.0,1433173006
1192,TomJensenMorgan1960,oil,t5_2qhl1,Oil Glut Part 3: Big Data Will Propel The Next U.S. Shale Oil Boom - Forbes,1423687616.0,1433174099
1193,SkylerVeronica,oil,t5_2qhl1,U.S. oil contango vanishing as supply glut shifts abroad,1432935061.0,1433195380
1194,MoisesCynthia,oil,t5_2qhl1,US Oil and Natural Gas Rig Count Drops by 10 to 875,1432935233.0,1433195486
1195,BraylonKingston,oil,t5_2qhl1,U.S. Oil Drilling Retreat Drags on for 25th Straight Week,1432935749.0,1433196640
1196,biokemau,oil,t5_2qhl1,RULER Oil Analysis Biokem.pptx,1414779943.0,1433237447
1197,GeoStarRunner,oil,t5_2qhl1,Oil up ahead of OPEC meeting as dollar slips,1419441235.0,1433255157
1198,TomJensenMorgan1960,oil,t5_2qhl1,"Oklahoma Oil is OK, Recent Activity Report",1423687616.0,1433274508
1199,DeonJaylyn,oil,t5_2qhl1,"The U.S. Oil Industry Just Set a New Record, and It Isn’t Pretty",1432935454.0,1433283624
1200,iraqoilreport,oil,t5_2qhl1,Oil exports keep pushing record highs,1415911244.0,1433300788
1201,stylesatlife,oil,t5_2qhl1,How to Use Olive Oil for Glowing Skin,1402370756.0,1433302767
1202,ConnerSawyer,oil,t5_2qhl1,Oil and Gas Energize U.S. Job Market,1433193010.0,1433316688
1203,biokemau,oil,t5_2qhl1,RULER Oil Analysis Biokem,1414779943.0,1433317480
1204,Digitallook01,oil,t5_2qhl1,"Commodities: Oil falls as OPEC set to hold output at 30mbpd, gold slips after early gains",1410967566.0,1433335315
1205,GeoStarRunner,oil,t5_2qhl1,Oil rig in the North Sea of Scotland,1419441235.0,1433341366
1206,angelinagoretti,oil,t5_2qhl1,Amaranth Oil Market,1426660551.0,1433346408
1207,maxstephon,oil,t5_2qhl1,Selling Ohio Mineral Rights and Oil &amp; Gas Royalties,1327406247.0,1433397502
1208,Veronica-Skyler,oil,t5_2qhl1,Coast Guard Says U.S. Faces Ship Shortage for Gas Exports,1433377270.0,1433411098
1209,PaytonKarter,oil,t5_2qhl1,"Roads, Bridges, Buses, Bikes and the Federal Gas Tax",1432933993.0,1433412773
1210,gkantchev,oil,t5_2qhl1,Investors flee oil ahead of OPEC meeting,1336654035.0,1433413889
1211,Emmett-Ricardo,oil,t5_2qhl1,Key U.S. House official warms to U.S. oil exports,1433430944.0,1433431086
1212,TomJensenMorgan1960,oil,t5_2qhl1,Analyzing Oilfield Operator Performance: The Creaming Curve,1423687616.0,1433452875
1213,DesmondGerard,oil,t5_2qhl1,Report: Natural Gas Will Chop Away at Oil’s Dominance as Transportation Fuel,1433375536.0,1433492070
1214,cod3r__,oil,t5_2qhl1,OPEC refuses to cut oil production,1398910829.0,1433508560
1215,GeoStarRunner,oil,t5_2qhl1,Falkland oil driller to press on despite Argentina legal threat,1419441235.0,1433547267
1216,mehrnews,oil,t5_2qhl1,Indonesia to buy Iran oil,1422190542.0,1433570706
1217,naturaltherapy1,oil,t5_2qhl1,Herbal Hair Oil Manufacturers | Suppliers India,1415361755.0,1433576021
1218,Veronica-Skyler,oil,t5_2qhl1,U.S. oil production growing rapidly,1433377270.0,1433578573
1219,Cynthia-Moises,oil,t5_2qhl1,"OPEC Set To Stabilize Oil Production At Vienna Meeting As Crude Prices Stabilize, US Drilling Wanes",1433377435.0,1433578706
1220,arganoilforhair243,oil,t5_2qhl1,Argan Oil for Hair,1424857921.0,1433583492
1221,biokemau,oil,t5_2qhl1,ENTRAINED GAS IN LUBRICATION OIL.pptx,1414779943.0,1433606483
1222,GeoStarRunner,oil,t5_2qhl1,Every U.S. oil company is a potential takeover target,1419441235.0,1433634774
1223,QueenRedditSnoo,oil,t5_2qhl1,Oil Price hits a Triple Bottom. Price Surge Likely on Monday. Last time 3/17/2015 saw a Big Spike of 27% over 6 weeks.,1428454385.0,1433656200
1224,cod3r__,oil,t5_2qhl1,Forget the noise: Oil prices won't crash again,1398910829.0,1433690370
1225,Jaylyn-Deon_,oil,t5_2qhl1,U.S. Oil-Rig Count Drops Modestly Again,1433755512.0,1433755561
1226,TomJensenMorgan1960,oil,t5_2qhl1,China Now World's Largest Oil Importer; Effect on Global Market - Forbes,1423687616.0,1433772565
1227,lloydfinch,oil,t5_2qhl1,Domestic oil suppliers... Best I've ever used! (UK Only),1431005407.0,1433842323
1228,TomJensenMorgan1960,oil,t5_2qhl1,U.S. Oil Production to Peak at 43-Year High Before Trailing Off,1423687616.0,1433880954
1229,easternoil48341,oil,t5_2qhl1,Read this article to get tips for safely handling oil and lubricants.,1407999414.0,1433913091
1230,nivraleog,oil,t5_2qhl1,Changing Oil of Your Car for Longer Life of Car,1391080353.0,1433918538
1231,StevenAxel_,oil,t5_2qhl1,"Iraq to assemble 27,000-strong ‘oil army’ to protect energy assets from Isis",1433751200.0,1433918801
1232,greenteaapple,oil,t5_2qhl1,Glencore in Singapore fuel oil spree as cargo premium slumps,1390803721.0,1433926399
1233,pluslifestyles,oil,t5_2qhl1,Top 9 Health Benefits of Sandalwood Oil | Plus Lifestyles,1401712854.0,1434020389
1234,Energy_Karel,oil,t5_2qhl1,Canada will find US shale oil revolution hard act to follow,1425397055.0,1434027329
1235,TomJensenMorgan1960,oil,t5_2qhl1,Exporting U.S. Crude Oil is a Moral Obligation - Forbes,1423687616.0,1434037771
1236,JessicaAndris,oil,t5_2qhl1,Vacuum the Oil Dry,1418240866.0,1434039789
1237,TomJensenMorgan1960,oil,t5_2qhl1,Chinese Oil Imports: the New Bull in the Oil Shop,1423687616.0,1434046564
1238,JessicaAndris,oil,t5_2qhl1,BioKem Vacuum Dehydration Oil Purification System,1418240866.0,1434099875
1239,ChemicalsIARC,oil,t5_2qhl1,Industrial Gear Oils market to reach $5.8 billion by 2020 - IndustryARC,1433936721.0,1434106547
1240,sciencecow,oil,t5_2qhl1,"For Oil Price, Bad Is The New Good",1419723709.0,1434123806
1241,GeoStarRunner,oil,t5_2qhl1,A little breakdown of what comes out of a single barrel of crude oil,1419441235.0,1434140991
1242,mehrnews,oil,t5_2qhl1,Iran’s oil production ups in May,1422190542.0,1434185104
1243,BrayanHolly_,oil,t5_2qhl1,US Oil Producing States Struggling for Growth at Current Prices,1433757232.0,1434216589
1244,nsindi,oil,t5_2qhl1,"Jane Fonda takes on 'big oil' in Vancouver: 'Arrest me, I don't care'",1427175454.0,1434231799
1245,macus16,oil,t5_2qhl1,"UK based Oil Redditors, I'm running a study I would like you to take.",1275141457.0,1434282121
1246,TomJensenMorgan1960,oil,t5_2qhl1,Noble Energy: Operator Highlights - Forbes,1423687616.0,1434379224
1247,cantbelieveitsbacon,oil,t5_2qhl1,Low Oil Price Challenge met with American Ingenuity,1415739268.0,1434393191
1248,gkantchev,oil,t5_2qhl1,What's next for oil? Is OPEC dead? How is the US shale industry coping with the downturn? A Pulitzer prize winning author explains,1336654035.0,1434400139
1249,ChemicalsIARC,oil,t5_2qhl1,Oilfield Surfactants Market Analysis and Forecast (2014-2020) - IndustryARC,1433936721.0,1434440051
1250,ChemicalsIARC,oil,t5_2qhl1,Oilfield Surfactant Market (2014-2020),1433936721.0,1434440667
1251,Keatonn-Ainsley_,oil,t5_2qhl1,Global Oil Oversupply Seen Running At 2 million barrels a day,1434441570.0,1434441647
1252,Energy_Karel,oil,t5_2qhl1,Good luck G7 leaders – we won’t be off fossil fuels by 2100,1425397055.0,1434457400
1253,GeoStarRunner,oil,t5_2qhl1,"US Factory Output Down in May, Hurt by Decline in Oil Refining",1419441235.0,1434465953
1254,Energy_Karel,oil,t5_2qhl1,"As race for Arctic oil and gas reserves heats up, so do the war games: special report on operation Northern Edge",1425397055.0,1434480810
1255,jamespaul2019,oil,t5_2qhl1,"Fats and Oils Market by Type (Vegetable Oils, Animal Fats), Application – 2019",1431952774.0,1434522680
1256,Keatonn-Ainsley_,oil,t5_2qhl1,U.S. oil prices edge up as Texas braces for storm; Brent lower,1434441570.0,1434527775
1257,ChemicalsIARC,oil,t5_2qhl1,Oilfield Surfactants Market Trend (2015-2020) - IndustryARC,1433936721.0,1434531778
1258,TomJensenMorgan1960,oil,t5_2qhl1,Why Biofuels Can't Replace Oil - Forbes,1423687616.0,1434552425
1259,TomJensenMorgan1960,oil,t5_2qhl1,10 Big Stories in Oil,1423687616.0,1434552773
1260,marry144,oil,t5_2qhl1,Nigeria Starts Investigating Crude Oil Swap Contracts,1419253255.0,1434562071
1261,wnose,oil,t5_2qhl1,Bloomberg: the world is facing its longest oil glut in at least three decades,1197235209.0,1434564045
1262,Karter-Aleaha_,oil,t5_2qhl1,U.S. Oil Prices Inch Higher | critical infrastructure alliance,1434606388.0,1434610872
1263,JessicaAndris,oil,t5_2qhl1,Options for Removing Water in Oil.pptx,1418240866.0,1434622687
1264,amiliasummer14,oil,t5_2qhl1,peppermint essential oil bulk,1423217980.0,1434630742
1265,SinopecUSA,oil,t5_2qhl1,($28.00) 5GAL-AW-HYDRAULIC-OIL ISO VG 32-10W-46-15W-68-20W PRICE? http://buysinopec.com/collections/hydraulics?,1432644249.0,1434634216
1266,whiskeydeltatango,oil,t5_2qhl1,"New pump jack at New Mexico State Land Office is tribute to oil, gas revenues",1309825934.0,1434643797
1267,Nikitinskii,oil,t5_2qhl1,On Russian oil depot,1431676513.0,1434695718
1268,annaemilia,oil,t5_2qhl1,US Oil Inventories Decline For Sixth Straight Week: Glut Continues To Show Signs Of Abating,1400338830.0,1434698103
1269,amiliasummer14,oil,t5_2qhl1,Turmeric Essential Oil Suppliers,1423217980.0,1434715767
1270,shwetaverma123,oil,t5_2qhl1,"Buy Aroma Diffusers Online – Aroma Diffusers, Oils &amp; Candles Online @ExclusiveLane",1432295801.0,1434736015
1271,GeoStarRunner,oil,t5_2qhl1,Norway’s Shift From Oil Stirs Trouble in Fiords,1419441235.0,1434764045
1272,PeakOil12,oil,t5_2qhl1,What If We Never Run Out of Oil?,1434764274.0,1434764297
1273,mehrnews,oil,t5_2qhl1,Asian countries welcome Iran's gas oil,1422190542.0,1434791464
1274,amiliasummer14,oil,t5_2qhl1,Amla Fruit Oil Wholesale For Natural Hair Treatment,1423217980.0,1434802691
1275,GeoStarRunner,oil,t5_2qhl1,"Back in 200 BC the Han dynasty drilled for natural gas, transported it in pipelines and gas containers and burned it in stoves",1419441235.0,1434847777
1276,TexasNorth,oil,t5_2qhl1,"Saudi Arabia raises production to maximum levels, escalating oil market share battle",1392476684.0,1434873466
1277,KeatonnAinsley_11,oil,t5_2qhl1,"U.S. oil rigs decline, but up in Permian, Bakken -Baker Hughes",1434784640.0,1434956555
1278,JessicaAndris,oil,t5_2qhl1,Vacuum the Oil Dry.pptx,1418240866.0,1434959854
1279,easternoil48341,oil,t5_2qhl1,Learn more about a few ideas to get oil stains out of your clothing.,1407999414.0,1434969021
1280,wolfram184,oil,t5_2qhl1,French or Persian as second language in oil industry?,1291944332.0,1435001147
1281,ital0conti,oil,t5_2qhl1,"TEXAS ENERGY EXPLORATION, LLC ABSTRACT OF SALT-DOME LOCATIONS IN THE GULF COASTAL PLAIN, SOUTH-CENTRAL UNITED STATES",1435029248.0,1435029385
1282,KeatonnAinsley_11,oil,t5_2qhl1,Rising U.S. Oil Demand in 2015 – and Beyond,1434784640.0,1435044693
1284,TomJensenMorgan1960,oil,t5_2qhl1,Effect of Saudi Arabia Decisions on Global Crude Oil Supply &amp; Demand - Forbes,1423687616.0,1435074736
1285,hannahnewlin,oil,t5_2qhl1,History of Oil,1277130732.0,1435110333
1286,ChemicalsIARC,oil,t5_2qhl1,Turbine Oil Market (2014-2020),1433936721.0,1435128894
1287,KeatonnAinsley_11,oil,t5_2qhl1,Why A U.S Shale Slowdown Will Hardly Affect Oil Prices,1434784640.0,1435129821
1288,skilletbizkit309,oil,t5_2qhl1,"The history of crude oil prices, explained in three charts",1430156282.0,1435144349
1289,gaop,oil,t5_2qhl1,WTI oil futures turn lower after U.S. supply data,1212913848.0,1435212476
1290,annaemilia,oil,t5_2qhl1,"Gasoline Inventories Increase, But We Continue to See Signs That the Oil Supply Glut Is Ending",1400338830.0,1435227857
1291,TomJensenMorgan1960,oil,t5_2qhl1,Is European Energy Sustainable? - Forbes,1423687616.0,1435269025
1292,TomJensenMorgan1960,oil,t5_2qhl1,U.S. refinery capacity reaches 18 million barrels per day - Today in Energy - U.S. Energy Information Administration (EIA),1423687616.0,1435273757
1293,LinkSinc,oil,t5_2qhl1,U.S. Oil Glut An EIA Invention? | OilPrice.com,1410214479.0,1435277096
1294,ann3batard,oil,t5_2qhl1,"Texas Energy Exploration, LLC on Summary and Reference Cited of Salt Domes",1435280070.0,1435280426
1295,biokemau,oil,t5_2qhl1,Removing Moisture from Lubricating Oils PowerPoint PPT Presentation,1414779943.0,1435334214
1296,hzaybek,oil,t5_2qhl1,How do I get started refining used engine oil?,1378162420.0,1435381676
1297,stylesatlife,oil,t5_2qhl1,How to Use Almond Oil for Dark Circles,1402370756.0,1435398851
1298,biokemau,oil,t5_2qhl1,Clean LubeOil Increases theLife of Rotational Equipment PowerPoint PPT Presentation,1414779943.0,1435406804
1299,greenoilindustries,oil,t5_2qhl1,Neem Oil In India,1433920674.0,1435409677
1300,sciencecow,oil,t5_2qhl1,A Year of Lower Oil Prices: Crossing A Boundary,1419723709.0,1435496246
1301,hannahnewlin,oil,t5_2qhl1,Oil History | The Oil Saga from 1990-2015,1277130732.0,1435543339
1302,salmanaegis,oil,t5_2qhl1,Baby Oil Manufacturing Company India,1399268930.0,1435558972
1303,Brayan_Mavericka,oil,t5_2qhl1,"WTI ticks down ending week below $60, as U.S. oil rigs continue decline",1435573924.0,1435573957
1304,gkantchev,oil,t5_2qhl1,Oil Stocks Hit Two-Year High in Europe Hub As Global Oil Glut Continues,1336654035.0,1435584526
1305,TomJensenMorgan1960,oil,t5_2qhl1,Easing the Malacca Energy Bottleneck: Is it Time for the Kra Canal? - Forbes,1423687616.0,1435588138
1306,JessicaAndris,oil,t5_2qhl1,Propel Oil Management Six Stages,1418240866.0,1435592483
1307,zotezoindia,oil,t5_2qhl1,Japani Oil Japani Tel,1431335943.0,1435650949
1308,Andrew_Bradley,oil,t5_2qhl1,U.S. weekly oil rig count decline slows: Baker Hughes,1435564524.0,1435665130
1309,biokemau,oil,t5_2qhl1,PPT - ENTRAINED GAS IN LUBRICATION OIL PowerPoint Presentation,1414779943.0,1435667080
1310,TomJensenMorgan1960,oil,t5_2qhl1,Shale Gas Flows in Morocco - Forbes,1423687616.0,1435701686
1311,forexminute-news,oil,t5_2qhl1,What Happened with the Oil Price Collapse?,1417023171.0,1435754310
1312,LinkSinc,oil,t5_2qhl1,EIA Data Still Doesn’t Add Up | OilPrice.com,1410214479.0,1435775659
1313,pluslifestyles,oil,t5_2qhl1,How to Use Sesame Seeds and Oils for Hair? | Plus Lifestyles,1401712854.0,1435813450
1314,whiskeydeltatango,oil,t5_2qhl1,BP to pay Alabama $2.3 billion for oil spill,1309825934.0,1435844837
1315,whiskeydeltatango,oil,t5_2qhl1,BP Agrees to Pay $18.7 Billion to Settle Deepwater Horizon Oil Spill Claims,1309825934.0,1435844954
1316,commodity_student,oil,t5_2qhl1,Crude oil storage question,1435863369.0,1435864238
1317,1knok04,oil,t5_2qhl1,Argan Oil,1434335375.0,1435897162
1319,QuantCasting,oil,t5_2qhl1,QuantCasting's July Oil Forecast,1429476119.0,1436033393
1320,rupierupe,oil,t5_2qhl1,Industry decline is about to escalate in the next few months due to expiration of oil price hedges.,1426116229.0,1436071462
1321,LinkSinc,oil,t5_2qhl1,EIA Data Still Diverging From Reality | OilPrice.com,1410214479.0,1436141295
1323,smotfi1,oil,t5_2qhl1,10 Amazing Benefits of Olive Oil Massage - 12 Massaging Tips.,1424776699.0,1436166121
1324,Melanie_Bryson,oil,t5_2qhl1,Oil slides in thin trade on rising U.S. rig count,1435995843.0,1436174319
1325,egyptianchambers,oil,t5_2qhl1,Myrrh Oil – The Numerous Benefits and Varied Importance,1435826264.0,1436178051
1326,alfomarkets,oil,t5_2qhl1,The shale oil supply puts new pressure on oil price,1425392417.0,1436178314
1327,skilletbizkit309,oil,t5_2qhl1,"Despite recent falls, Halliburton is still one of the best-performing oil stocks on the market this year",1430156282.0,1436207509
1328,skilletbizkit309,oil,t5_2qhl1,A brief history of the largest oil and gas mergers ever,1430156282.0,1436215150
1329,shahkhan1230,oil,t5_2qhl1,Breaking news - Oil rebounds in Asia,1433401285.0,1436250024
1330,EmiliaGmBianca_,oil,t5_2qhl1,Oil falls more than 3 percent after Greek ‘No’,1435824400.0,1436258770
1331,Alisonmelia,oil,t5_2qhl1,Providing customers with best quality fuel at their doorstep,1415796784.0,1436263449
1332,LinkSinc,oil,t5_2qhl1,"Don’t Panic, Nothing Has Really Changed In The Oil Markets | OilPrice.com",1410214479.0,1436323227
1333,sciencecow,oil,t5_2qhl1,Something Solid: World Oil Demand Increases,1419723709.0,1436327197
1334,GeoStarRunner,oil,t5_2qhl1,Good ELI5 on the relationship of oil prices and gas prices,1419441235.0,1436329479
1335,hemaniherbal,oil,t5_2qhl1,Benefits of Blackseeds Oil,1433496709.0,1436441290
1336,jpsondolt682,oil,t5_2qhl1,"Once exports officially begin early next year, Cheniere will be at the forefront of the United States' liquefied natural gas revolution",1435672538.0,1436472995
1337,tackytrader14709,oil,t5_2qhl1,Here's why WTI oil prices bounced back more than 2% today,1436473783.0,1436473893
1338,sallymontgomery81,oil,t5_2qhl1,UK Oil Products: The Rise and Fall,1400513152.0,1436519131
1339,timsouthy213,oil,t5_2qhl1,Light Oil for Hair,1436519810.0,1436521086
1340,whiskeydeltatango,oil,t5_2qhl1,Oil refiners' mini golden era will end soon - IEA,1309825934.0,1436534480
1341,oluies,oil,t5_2qhl1,Dutch government bans shale gas drilling for 5 years.,1345319327.0,1436542855
1342,rebeccamorr16,oil,t5_2qhl1,Trinity Energy Group: A Short Introduction to Petroleum Geology,1436586756.0,1436586929
1343,EmiliaGmBianca3_,oil,t5_2qhl1,Oil Prices Rise on China Recovery and Iran Deadlock,1436528624.0,1436605201
1344,JessicaAndris,oil,t5_2qhl1,Hot Oil Flushing Methodology Biokem,1418240866.0,1436635467
1345,JessicaAndris,oil,t5_2qhl1,PPT - Hot Oil Flushing Methodology Biokem PowerPoint Presentation,1418240866.0,1436682176
1346,LinkSinc,oil,t5_2qhl1,EIA Confirms: Oil Production Peaked,1410214479.0,1436751857
1347,Cyceon,oil,t5_2qhl1,Are Oil prices on the track of a structural fall?,1430931579.0,1436767880
1348,skilletbizkit309,oil,t5_2qhl1,"Marathon Petroleum announced a merger with MarkWest Energy LP, becoming the fourth-largest oil MLP in the U.S.",1430156282.0,1436794246
1349,GeoStarRunner,oil,t5_2qhl1,BP's oil rigs just got their own Internet of Things,1419441235.0,1436799909
1350,ramseyoil,oil,t5_2qhl1,Ramsey Oil,1427284790.0,1436853922
1351,ermenetrevi16,oil,t5_2qhl1,"Trinity Energy Group, Inc.: How to Drill a Well for Oil and Gas",1436856220.0,1436856337
1352,lloydfinch,oil,t5_2qhl1,What more is there to know on domestic heating oil tanks??,1431005407.0,1436863544
1353,Alisonmelia,oil,t5_2qhl1,Looking for the best quality of oil suitable for your car,1415796784.0,1436864128
1354,SofaSoGood,oil,t5_2qhl1,Real time interactive chart of Iranian oil,1296432458.0,1436872802
1355,skilletbizkit309,oil,t5_2qhl1,Why the new Iran deal won't drive oil prices down anytime soon,1430156282.0,1436881657
1356,TomJensenMorgan1960,oil,t5_2qhl1,Technology Innovation and Adoption in Oil &amp; Gas Industry -- Why Did It Slow? - Forbes,1423687616.0,1436883586
1357,GeoStarRunner,oil,t5_2qhl1,Landmark deal reached on Iran nuclear program,1419441235.0,1436885455
1358,CapCrude,oil,t5_2qhl1,"If Congress doesn't change US crude oil export policy soon, it'll likely be left to the next president sometime in 2017.",1422911605.0,1436900784
1359,arganoilforhair243,oil,t5_2qhl1,Argan Oil for Hair,1424857921.0,1436940053
1360,rebeccamorr16,oil,t5_2qhl1,Welcome to Trinity Energy Group Services,1436586756.0,1436946483
1361,equipadvantage,oil,t5_2qhl1,WPX Energy to buy RKI Exploration &amp; Production,1436923731.0,1436971990
1362,oluies,oil,t5_2qhl1,How the plunging price of oil has set off a new global contest,1345319327.0,1437015990
1363,eventually_i_will,oil,t5_2qhl1,Bakken: An Oil Life Suspended,1330130638.0,1437018677
1364,ermenetrevi16,oil,t5_2qhl1,Welcome to Trinity Energy Group Services,1436856220.0,1437032463
1365,fronz13,oil,t5_2qhl1,"Heard you guys might like this story - As oil prices drop, will Islamic extremism suffer?",1307527138.0,1437049605
1366,VW2S4,oil,t5_2qhl1,"5 Million Litre Oil Spill at Nexen, Long Lake",1388795188.0,1437090388
1367,Energy_Karel,oil,t5_2qhl1,The new fracking – how shale gas may yet transform the European energy market,1425397055.0,1437127402
1368,BestOfOilVoice,oil,t5_2qhl1,Oil Price Crash of 2014 / 15 Update,1437144646.0,1437144982
1369,TomJensenMorgan1960,oil,t5_2qhl1,Refiners Race to Make Cheap Oil Into Gasoline,1423687616.0,1437152609
1370,ideln,oil,t5_2qhl1,"All coiled tubing pros, this is your community!",1437159858.0,1437161043
1371,ILS_RW24R,oil,t5_2qhl1,Oil Jobs?,1436311091.0,1437161652
1372,JuanitoDillon,oil,t5_2qhl1,Rep. Ed Whitfield on Rethinking the Oil Export Ban,1273305156.0,1437192298
1373,USANewsToday,oil,t5_2qhl1,The 10 most oil-rich US states,1437238686.0,1437238712
1374,VW2S4,oil,t5_2qhl1,Suncor Launches Pilot Project Using Radio Waves Instead of Steam for In Situ Oil Sand Deposits,1388795188.0,1437309540
1375,kaelwilson,oil,t5_2qhl1,An Overview on Benefits One Can have on Regular Car Oil and Filter Check-up,1381149055.0,1437377482
1376,TomJensenMorgan1960,oil,t5_2qhl1,Effect of Oil Price decline on North American shale,1423687616.0,1437401197
1377,CapCrude,oil,t5_2qhl1,"Now that the ink has dried on the Iran deal, what does it mean for global crude supply and demand? How much more oil is coming on to the market? When? Where's it going? And what about prices?",1422911605.0,1437402233
1378,BestOfOilVoice,oil,t5_2qhl1,The Iraqi-Kurd Oil agreement means dangerous political disagreement,1437144646.0,1437404434
1379,sammyl30nard,oil,t5_2qhl1,Trinity Energy Group Services - Company Resume,1437443958.0,1437444825
1380,arganoilforhair243,oil,t5_2qhl1,Argan Oil for Hair,1424857921.0,1437459138
1381,FranklinNatalyee,oil,t5_2qhl1,What Iran deal could mean for US ban on oil exports,1437470395.0,1437470426
1382,TomJensenMorgan1960,oil,t5_2qhl1,Oil Guru Who Called 2014 Slump Sees a Return to $100 Crude,1423687616.0,1437484366
1383,TomJensenMorgan1960,oil,t5_2qhl1,Natural Gas Dominates Under EPA's Clean Power Plan- Forbes,1423687616.0,1437485906
1384,bhavesh007,oil,t5_2qhl1,SteamPRO 80 OIL/GAS,1415170999.0,1437541340
